24484501,https://www.airbnb.com/rooms/24484501,20190714024644,2019-07-14,Top of the World,"5 bedrooms with 8 beds: 3 queen & 5 twin size; 3 sleeper sofas. Two full  bathrooms. Eat-in kitchen has fridge, stove, etc. Huge, bright living room with pool table, ping pong & darts. All above a great local Boston Irish bar with a full liquor license to serve until 2 a.m. It is a 2 minute walk to the Orange line T station & one T stop away from the TD Garden for Celtics, Bruins & concerts. Perfect for big groups, birthdays, bachelor and bachelorette parties, etc. Sleeps 10 to 16 comfortably.",NA,"5 bedrooms with 8 beds: 3 queen & 5 twin size; 3 sleeper sofas. Two full  bathrooms. Eat-in kitchen has fridge, stove, etc. Huge, bright living room with pool table, ping pong & darts. All above a great local Boston Irish bar with a full liquor license to serve until 2 a.m. It is a 2 minute walk to the Orange line T station & one T stop away from the TD Garden for Celtics, Bruins & concerts. Perfect for big groups, birthdays, bachelor and bachelorette parties, etc. Sleeps 10 to 16 comfortably. The apartment is above a great bar, The Tavern at the End of the World. Please feel free to (Hidden by Airbnb) it for reviews.",none,NA,"The apartment is above a great bar, The Tavern at the End of the World. Please feel free to (Hidden by Airbnb) it for reviews.",NA,NA,NA,No one under 21 years of age is allowed rent this apartment.,NA,NA,https://a0.muscache.com/im/pictures/932cb1f0-b149-4887-9fb8-48d8aafdf440.jpg?aki_policy=large,NA,114515516,https://www.airbnb.com/users/show/114515516,William,2017-02-02,"Boston, Massachusetts, United States",NA,within an hour,100%,N/A,TRUE,https://a0.muscache.com/im/pictures/feb01b13-3e04-49ab-8c51-0979f05f8bb8.jpg?aki_policy=profile_small,https://a0.muscache.com/im/pictures/feb01b13-3e04-49ab-8c51-0979f05f8bb8.jpg?aki_policy=profile_x_medium,NA,1,1,"['email', 'phone', 'reviews']",TRUE,FALSE,"Boston, MA, United States",Charlestown,Charlestown,NA,Boston,MA,02129,Boston,"Boston, MA",US,United States,42.38111,-71.07878,FALSE,Apartment,Entire home/apt,16,2,5,8,Real Bed,"{TV,Wifi,""Air conditioning"",Kitchen,Heating,""Suitable for events"",Washer,Dryer,""Smoke detector"",""Carbon monoxide detector"",""Fire extinguisher"",Essentials,Shampoo,Hangers,""Hair dryer"",Iron,""Laptop friendly workspace"",""Private entrance"",""Hot water"",""Bed linens"",""Extra pillows and blankets"",Microwave,""Coffee maker"",Refrigerator,Dishwasher,""Dishes and silverware"",Oven,Stove,""Host greets you""}",NA,$450.00,NA,NA,NA,$200.00,7,$20.00,2,28,1,3,28,28,2,28,today,TRUE,12,19,38,289,2019-07-14,48,43,2018-05-20,2019-06-30,98,10,10,10,10,10,10,FALSE,NA,"{""Massachusetts State"","" Massachusetts State""}",TRUE,FALSE,moderate,FALSE,FALSE,1,1,0,0,3.42
24628253,https://www.airbnb.com/rooms/24628253,20190714024644,2019-07-14,"Beautiful ,Cozy & Convenient private room",1 bedroom located minutes away from Faneuil hall Boston .  Public transportation accessible .  One queen bed available in shared apartment.,NA,1 bedroom located minutes away from Faneuil hall Boston .  Public transportation accessible .  One queen bed available in shared apartment. Fully stocked kitchen guests can utilize. coin-op laundry located in building . I’m available via phone or email Quiet location within footsteps of downtown Boston . About a 3 minute walk from 2 train stations . Bunker hill and Sullivan station,none,Quiet location within footsteps of downtown Boston .,NA,About a 3 minute walk from 2 train stations . Bunker hill and Sullivan station,Fully stocked kitchen guests can utilize. coin-op laundry located in building .,I’m available via phone or email,- No shoes in apartment - No parties or events,NA,NA,https://a0.muscache.com/im/pictures/bcfd7a53-a3ca-4b12-a6a5-7bcbaff284b3.jpg?aki_policy=large,NA,39559135,https://www.airbnb.com/users/show/39559135,Merrelin,2015-07-25,"Massachusetts, United States",NA,N/A,N/A,N/A,FALSE,https://a0.muscache.com/im/users/39559135/profile_pic/1437880720/original.jpg?aki_policy=profile_small,https://a0.muscache.com/im/users/39559135/profile_pic/1437880720/original.jpg?aki_policy=profile_x_medium,Charlestown,1,1,"['email', 'phone', 'reviews', 'jumio', 'government_id', 'work_email']",TRUE,FALSE,"Boston, MA, United States",Charlestown,Charlestown,NA,Boston,MA,02129,Boston,"Boston, MA",US,United States,42.37992,-71.0721,TRUE,Apartment,Private room,5,1,1,1,Real Bed,"{TV,Wifi,""Air conditioning"",Kitchen,""Smoking allowed"",Elevator,""Free street parking"",Heating,""Family/kid friendly"",Washer,Dryer,""Smoke detector"",""Carbon monoxide detector"",Essentials,""Hair dryer"",Iron,""Self check-in"",Keypad,""Hot water"",""Bed linens"",Microwave,Refrigerator,""Single level home"",""Long term stays allowed""}",NA,$102.00,NA,NA,$0.00,$15.00,2,$20.00,1,32,1,1,32,32,1,32,3 months ago,TRUE,0,0,0,0,2019-07-14,17,13,2018-06-19,2019-03-30,80,9,8,9,9,8,8,FALSE,NA,"{""Massachusetts State"","" Massachusetts State""}",TRUE,FALSE,strict_14_with_grace_period,FALSE,FALSE,1,0,1,0,1.3
24914428,https://www.airbnb.com/rooms/24914428,20190714024644,2019-07-14,5 ⭐ French Eco-Vegan in City Square + Free Parking,"Our Maison Coloniale ideally hosts 2, and can uniquely accommodate up to 4. ⭐ AIRPORT ⭐ 10 minute RIDE ⭐ ENCORE BOSTON HARBOR ⭐ 5 minute RIDE ⭐ NORTH END ⭐ 15 minute WALK ⭐ TD GARDEN (Bruins • Celtics • Concerts) & NORTH STATION (Subway) ⭐ 13 minute WALK YOU GET: • Parking ($40/Day Value) • High-Speed 5G Wifi • Hulu Live, Netflix 1-4 MINUTE WALK: • Freedom Trail, Bunker Hill • Whole Foods, Starbucks 5-10 MINUTE WALK: • USS Constitution • Ferry (to Long Wharf) • Community College (Subway)","BIENVENUE! ⭐ LE SALON ⭐ The parlor living room (or 2nd bedroom) maintains a private entrance and interior French Doors that can convert the space to a 2nd bedroom. Bed: Luxury queen sleeper sofa with memory foam mattress because you deserve the best! (Sleeps 2) Room Features: Sarreid Dresser • Fair-Trade West Elm Curtains • Flora Chandelier • 40"" Sony SmartTV ⭐ LE CHAMBRE ⭐ French decor and baroque chandelier accent a bedroom with double closet and private entrance (off-kitchen). Bed: Queen bed with luxury hybrid mattress. Guests LOVE this mattress! (Sleeps 2) Room Features: Parisian Loveseat • Fair-Trade West Elm Curtains • Ambient Sound Machine • Clothes Steamer & Iron • Ironing Board ⭐ LA CUISINE ⭐ Eat-in French farmhouse kitchen comfortably seats 4 around the dinner table! Room Features: Ninja Coffee Bar • Minifridge • Microwave • Toaster • Bamboo Cook & Dinnerware • Cooking Essentials • Filtered Water Pitcher (Pass On Plastic!) Bon Appétit! ⭐ LE BAIN ⭐ Rustic-remodeled bathroom wi","Our Maison Coloniale ideally hosts 2, and can uniquely accommodate up to 4. ⭐ AIRPORT ⭐ 10 minute RIDE ⭐ ENCORE BOSTON HARBOR ⭐ 5 minute RIDE ⭐ NORTH END ⭐ 15 minute WALK ⭐ TD GARDEN (Bruins • Celtics • Concerts) & NORTH STATION (Subway) ⭐ 13 minute WALK YOU GET: • Parking ($40/Day Value) • High-Speed 5G Wifi • Hulu Live, Netflix 1-4 MINUTE WALK: • Freedom Trail, Bunker Hill • Whole Foods, Starbucks 5-10 MINUTE WALK: • USS Constitution • Ferry (to Long Wharf) • Community College (Subway) BIENVENUE! ⭐ LE SALON ⭐ The parlor living room (or 2nd bedroom) maintains a private entrance and interior French Doors that can convert the space to a 2nd bedroom. Bed: Luxury queen sleeper sofa with memory foam mattress because you deserve the best! (Sleeps 2) Room Features: Sarreid Dresser • Fair-Trade West Elm Curtains • Flora Chandelier • 40"" Sony SmartTV ⭐ LE CHAMBRE ⭐ French decor and baroque chandelier accent a bedroom with double closet and private entrance (off-kitchen). Bed: Queen bed with lu",none,"91 on WalkScore•com • ""Walker's Paradise"" ⭐ TD GARDEN • Bruins • Celtics • Concerts • Events • Graduation • North Station ⭐ 12 minute WALK ⭐ ENCORE BOSTON HARBOR CASINO ⭐ 5 minute RIDE  ⭐ NORTH END • Boston's Little Italy ⭐ 15 minute WALK ⭐ HISTORY NEARBY ⭐ • Bunker Hill Monument • 1 minute WALK • Freedom Trail (end of) • 1 minute WALK • USS Constitution • 8 minute WALK • Warren Tavern Restaurant • 1 minute WALK ⭐ COMPANIES NEARBY ⭐ • Converse • 11 minute WALK • EF Education • 11 minute WALK • HubSpot • 20 minute WALK • Kayak • 20 minute WALK • RSM US LLP • 3 minute WALK • Shoes•com • 4 minute WALK • Trip Advisor • 12 minute WALK ⭐ TRANSPORTATION NEARBY ⭐ • 92/93 Bus • 1 minute WALK • Blue Bikes • 1 minute WALK • Commuter Rail (North Station) • 13 minute WALK • Ferry (to Long Wharf) • 12 minute WALK • Subway (Community College) • 8 minute WALK • Subway (North Station) • 13 minute WALK • I-93 N/S Access Ramp • 1 minute RIDE • Logan International Airport • 10 minute RIDE • South Station","See House Rules. Sound travels in our historic home. Please be considerate of other guests and residents. Use inside voices, step lightly, do not run or stomp, and do not roll luggage across our wonderfully restored floors. The common lobby is equipped with G00gle Nest Security for guest safety and compliance. House Rules are enforced 24/7. CHECK-IN: 3PM (15:00) CHECK-OUT: 11AM (11:00) QUIET HOURS: 10PM – 9AM (22:00 – 09:00) HOST HOURS (pending emergency): 9AM – 9PM (09:00 – 21:00)","GETTING AROUND Lyft & Uber are abundant, but our home is within a 20-minute walk to almost anywhere! WALK to TD Garden • Celtics • Bruins • Concerts • Events • Graduation WALK to the North End (Boston's Little Italy) WALK to Green Line (Subway) at North Station WALK to Commuter Rail (to Salem/Gloucester) at North Station WALK to Orange Line (Subway) at Community College WALK to Charlestown Navy Yard Ferry (to Long Wharf) WALK to Blue Bikes (Register at BlueBikes•com) WALK to 92/93 T Bus (to Quincy Market • Faneuil Hall • Financial District • Downtown Crossing • Assembly Row-Somerville • Encore Boston Harbor Casino)","• Listed Home in Reservation • Common Lobby, Emergency Exits • 1 Parking Space (with host confirmation)",We are owners who live on-location so whenever possible we personally accommodate check-in. We interact with guests as they prefer and are happy to lend insight.,"We live on-location, please respect our House Rules 24/7. CHECK-IN: 3PM (15:00) CHECK-OUT: 11AM (11:00) QUIET HOURS: 10PM – 9AM (22:00 – 09:00) HOST HOURS (pending emergency): 9AM – 9PM (09:00 – 21:00) HOUSE RULES: • No smoking or drug use • No candles or flammables • No unauthorized overnight guests • No parties, loud music, or excessive noise • No speakers or amplifiers allowed in home • Home must never exceed (6) total occupants (including reservation guests) • Turn off AC when leaving home • Non-reservation guests must depart home by 10PM (22:00) • Only reservation guests may enter home after 10PM (22:00) • Guests must not divulge building access code to non-reservation persons ADDITIONAL HOUSE RULES: • The common lobby is equipped with G00gle Nest Security for guest safety and compliance. • Parking is included. Size restrictions apply. Guest must confirm vehicle make/model. Guest must confirm parking with host 48 hours prior to the arrival date (guest will not receive parking othe",NA,NA,https://a0.muscache.com/im/pictures/0662aa22-6ee5-4d7f-893b-7590be279a57.jpg?aki_policy=large,NA,11410590,https://www.airbnb.com/users/show/11410590,Nika & Tony,2014-01-18,"Boston, Massachusetts, United States","Hello there!

We are a Husband & Wife duo living in historic Boston, Massachusetts! After spending a couple of uninspiring years in America's private sector, we reached the mutual conclusion that we had to focus on what we love most - Planet Earth and traveling to see all of its beauty! And that's pretty much where and how Sleepy Panda began! Together, we design and renovate unique eco-vegan homes that inspire eco-consciousness while promoting sustainable living. Our eco-vegan homes revolve around a central ethos of love for planet and respect for all sentient beings on Earth!

We can't wait to meet you!",within a few hours,100%,N/A,TRUE,https://a0.muscache.com/im/pictures/user/cf21bbc7-52f8-427a-a5ad-702500a4cdf1.jpg?aki_policy=profile_small,https://a0.muscache.com/im/pictures/user/cf21bbc7-52f8-427a-a5ad-702500a4cdf1.jpg?aki_policy=profile_x_medium,Charlestown,5,5,"['email', 'phone', 'google', 'reviews', 'jumio', 'offline_government_id', 'government_id']",TRUE,FALSE,"Boston, MA, United States",Charlestown,Charlestown,NA,Boston,MA,02129,Boston,"Boston, MA",US,United States,42.37298,-71.0634,TRUE,Apartment,Entire home/apt,4,1,1,1,Real Bed,"{TV,""Cable TV"",Wifi,""Air conditioning"",Kitchen,""Free parking on premises"",Heating,""Family/kid friendly"",""Smoke detector"",""Carbon monoxide detector"",""First aid kit"",""Fire extinguisher"",Essentials,Shampoo,Hangers,""Hair dryer"",Iron,""Laptop friendly workspace"",""Self check-in"",Keypad,""Private entrance"",""Hot water"",""Bed linens"",""Extra pillows and blankets"",Microwave,""Coffee maker"",Refrigerator,""Dishes and silverware"",""Cooking basics"",Oven,Stove,""Single level home"",""Patio or balcony"",""Long term stays allowed"",""No stairs or steps to enter"",""No stairs or steps to enter"",""No stairs or steps to enter"",""Fixed grab bars for shower""}",NA,$125.00,NA,NA,$200.00,$100.00,3,$20.00,1,14,1,2,14,14,1.1,14,today,TRUE,6,28,48,128,2019-07-14,63,50,2018-05-20,2019-06-28,99,10,10,10,10,10,10,FALSE,NA,"{""Massachusetts State"","" Massachusetts State""}",FALSE,FALSE,moderate,FALSE,FALSE,4,4,0,0,4.49
24992422,https://www.airbnb.com/rooms/24992422,20190714024644,2019-07-14,Luxurious Home in Boston's Historic Charlestown,"Featured in Boston Design Guide.  Luxurious full floor condo in the historic and charming gaslight district of Boston's Charlestown section.  Steps to Bunker Hill Monument and 1.5 miles from Encore Casino.  Brand new kitchen with high end copper finishes, new appliances.  HD Smart TV with cable, movie, streaming.  Queen size memory foam mattress, walk in closet, comfy pullout couch, full bathroom w/ newly tiled standing shower, washer/dryer and hotel-like amenities (shampoo, soap, etc.).","It was important to us to preserve the historic feel of the home while updating it with modern amenities for maximum comfort.  Guests enjoy the benefits of a home with a fully stocked kitchen, washer/dryer, walk in closet, 65 inch curved TV with full cable/movie/sports channels, front and back door keypad entry and reliable Wifi, while having hotel amenities such as individual bottles of shampoo, conditioner, body lotion, toothbrush, toothpaste, etc.","Featured in Boston Design Guide.  Luxurious full floor condo in the historic and charming gaslight district of Boston's Charlestown section.  Steps to Bunker Hill Monument and 1.5 miles from Encore Casino.  Brand new kitchen with high end copper finishes, new appliances.  HD Smart TV with cable, movie, streaming.  Queen size memory foam mattress, walk in closet, comfy pullout couch, full bathroom w/ newly tiled standing shower, washer/dryer and hotel-like amenities (shampoo, soap, etc.). It was important to us to preserve the historic feel of the home while updating it with modern amenities for maximum comfort.  Guests enjoy the benefits of a home with a fully stocked kitchen, washer/dryer, walk in closet, 65 inch curved TV with full cable/movie/sports channels, front and back door keypad entry and reliable Wifi, while having hotel amenities such as individual bottles of shampoo, conditioner, body lotion, toothbrush, toothpaste, etc. Guests have the entire first floor of a newly renova",none,"Charlestown is the oldest neighborhood in Boston, located north of the Charles River across from downtown Boston.  It's known for the Bunker Hill Monument, gaslight cobblestone and brick streets and beautiful historic townhouses.  The Bunker Hill Monument, located a few steps from the townhouse, marks the beginning of the ""Freedom Trail"", that shows part of Paul Revere's famous ride and several other historic sites.  There are stores and restaurants within 0.3 miles of the house, including Warren Tavern -- one of the most historic taverns in America, frequented by Paul Revere and visited by George Washington.  The house is also only 1.5 miles away from the new Encore Casino expected to open in June 2019.","There is a full stove, stovetop, dishwasher and microwave.  The fridge is a brand new compact fridge that does not have a freezer.  There is a corner store at the end of the block that sells ice. The house is also only 1.5 miles away from the new Encore Casino expected to open in June 2019.","Ubers and Lyfts are plentiful in the area.  There is a T stop 0.5 miles from the house (the orange line Bunker Hill Community College stop), a ferry to the Seaport within 0.5 miles and two hubway (bike sharing) stations within 0.3 miles.  It's about a mile to the North End section and about 1.5 miles to Beacon Hill.","Guests have the entire first floor of a newly renovated beautiful 1880 townhouse.  There are keypads on the front and back door for easy access. On the weekends there is free street parking for everyone and there are usually spots available.  During the week it's ""resident-only"" parking.  There are two garages about 1/2 a mile from the house -- Nautica Garage and Flagship Wharf Garage.","We live in the condo on the second and third floor of the townhouse, so we're available at a moment's notice if our guests have any questions or concerns.",NA,NA,NA,https://a0.muscache.com/im/pictures/703ed247-8ac0-4546-8e44-eaaebaafc5ea.jpg?aki_policy=large,NA,188938217,https://www.airbnb.com/users/show/188938217,Katherine And Dan,2018-05-10,"Boston, Massachusetts, United States",NA,within an hour,100%,N/A,TRUE,https://a0.muscache.com/im/pictures/user/f901d928-8dae-400a-ac0c-b1f543acba17.jpg?aki_policy=profile_small,https://a0.muscache.com/im/pictures/user/f901d928-8dae-400a-ac0c-b1f543acba17.jpg?aki_policy=profile_x_medium,Charlestown,1,1,"['email', 'phone', 'offline_government_id', 'government_id', 'work_email']",TRUE,FALSE,"Boston, MA, United States",Charlestown,Charlestown,NA,Boston,MA,02129,Boston,"Boston, MA",US,United States,42.37776,-71.06166,TRUE,Condominium,Entire home/apt,4,1,1,2,Real Bed,"{TV,Wifi,""Air conditioning"",Kitchen,Heating,""Family/kid friendly"",Washer,Dryer,""Smoke detector"",""Carbon monoxide detector"",Essentials,Shampoo,Hangers,""Hair dryer"",Iron,""Laptop friendly workspace"",""Self check-in"",Keypad,""Private entrance"",""Hot water""}",NA,$189.00,NA,NA,$250.00,$80.00,1,$0.00,2,1124,1,2,1124,1124,1.8,1124,3 days ago,TRUE,1,8,18,174,2019-07-14,67,56,2018-05-27,2019-07-10,99,10,10,10,10,10,10,FALSE,NA,"{""Massachusetts State"","" Massachusetts State""}",TRUE,FALSE,flexible,FALSE,FALSE,1,1,0,0,4.86
25085955,https://www.airbnb.com/rooms/25085955,20190714024644,2019-07-14,The Irish Castle on Bunker Hill ~,"In the clouds, high atop historic Charlestown sits a dwelling, seemingly imagined only in fantasy. The ""Irish Castle"" as it has been dubbed by friends was built in 1890 upon the entrance to the Bunker Hill National Monument & Freedom Trail.  My great grandmother, Catherine Gallagher moved to Monument Square from Ireland in 1906 and raised 9 children. I am the 4th generation of family living in this beautiful neighborhood.  I welcome travelers from all parts of the world to my peaceful home ~ !!","Spectacular sunlight & beautiful views abound. To the north, the magnificent Bunker Hill Monument sits like a gigantic spaceship, directly out the window... absolutely surreal.  On the south side of the apartment you can see the sunrise over the water, the USS Constitution & all the other sea craft that come into Boston... The west brings to view the entire city skyline and the amazing Zakim bridge... (wait till you see it lit up at night!) The Irish Castle is set up to RELAX, be healthy and enjoy yourself.  Aesthetically, my home is a healthy mix between vintage & retro (60's/70's) and the futuristic hi-technology of present Boston. The wireless internet connection is extremely high speed.","In the clouds, high atop historic Charlestown sits a dwelling, seemingly imagined only in fantasy. The ""Irish Castle"" as it has been dubbed by friends was built in 1890 upon the entrance to the Bunker Hill National Monument & Freedom Trail.  My great grandmother, Catherine Gallagher moved to Monument Square from Ireland in 1906 and raised 9 children. I am the 4th generation of family living in this beautiful neighborhood.  I welcome travelers from all parts of the world to my peaceful home ~ !! Spectacular sunlight & beautiful views abound. To the north, the magnificent Bunker Hill Monument sits like a gigantic spaceship, directly out the window... absolutely surreal.  On the south side of the apartment you can see the sunrise over the water, the USS Constitution & all the other sea craft that come into Boston... The west brings to view the entire city skyline and the amazing Zakim bridge... (wait till you see it lit up at night!) The Irish Castle is set up to RELAX, be healthy and enj",none,"Located at one end of the Freedom Trail, all you need do is walk out the front door and begin on foot exploring the city.  A 5 minute walk to the USS Constitution and the $2 commuter boat that takes you thru Boston Harbor to Fanueil Hall & Downtown.  Only 3 blocks away, the closet pub is ""The Warren Tavern"", the oldest pub in America. Opened in 1780 with help from Paul Revere, this was the place of George Washington's funeral speech.  There are amazing parks and waterways all over... also only a few walking blocks to Whole Foods, Local Coffee Shops & many of the best restaurants in the city. We are right in the middle of everything~!!!","We have 3 female dogs. All very well behaved, clean & friendly to guests... Annie is a Jack Russel Terrier, Astrid is a Portuguese Water Dog & Shimmy is a shepherd terrier mix... We keep the house very clean, and the pups don't leave much of a footprint in the home... Annie & Astrid have hair and do not shed / very easy on people who may have allergies.... The airflow in the apartment is great, plenty of fresh air!",The Orange Line runs to Bunker Hill (Community College) ~ and it is an 8 minute walk from there.. Buses run even closer and the entire neighborhood is really set up for walking/biking.,"You will have access to all parts of the apartment you may wish to use.... The kitchen, back living room and the Airbnb guest room are all on one side of the apartment, so there is plenty of privacy and space for you!","I am a certified yoga & meditation instructor & a vegan chef.  I am available for private instruction & to cook for you if you are feeling you would like a wholistic touch to your stay.  I also manage a small eclectic Jazz club and Art gallery in Cambridge that has live music 7 nights a week.  I can arrange tickets to performances upon request.  I also teach private music lessons on Piano, Guitar, Bass, Drums or Turntables ~","Please avoid hanging outside my apt on the street with your luggage, come right into the unlocked front hallway. Please be mindful to stay quiet on the stairs & hallway of my building ~ This is a neighborhood of old school Irish locals & millionaires.. I am very much not trying to draw any attention to the Airbnb lodging, please help me with this, Thank You!",NA,NA,https://a0.muscache.com/im/pictures/1ec6e0ab-96d7-45b7-a2a2-c4f2df2cdef5.jpg?aki_policy=large,NA,1742215,https://www.airbnb.com/users/show/1742215,Jesse,2012-02-12,"Boston, Massachusetts, United States","Professional Musician (Apollo Sunshine / Mythological Records)
Yoga Instructor (Integral Hatha Yoga)
Vegetarian since 2001' ~ Animal Lover  Jazz Club in Inman Sq. Cambridge",within a day,100%,N/A,TRUE,https://a0.muscache.com/im/pictures/user/8776af2f-7e12-4fb5-809c-cd4c736465c8.jpg?aki_policy=profile_small,https://a0.muscache.com/im/pictures/user/8776af2f-7e12-4fb5-809c-cd4c736465c8.jpg?aki_policy=profile_x_medium,Charlestown,1,1,"['email', 'phone', 'facebook', 'reviews', 'jumio', 'government_id']",TRUE,TRUE,"Boston, MA, United States",Charlestown,Charlestown,NA,Boston,MA,02129,Boston,"Boston, MA",US,United States,42.37567,-71.06117,TRUE,Apartment,Private room,4,1,1,2,Real Bed,"{TV,""Cable TV"",Wifi,Kitchen,""Pets allowed"",Breakfast,""Free street parking"",Heating,""Family/kid friendly"",""Suitable for events"",Essentials,Shampoo,Hangers,""Laptop friendly workspace"",""Private living room"",Bathtub,""Hot water"",""Bed linens"",""Extra pillows and blankets"",""Coffee maker"",Refrigerator,""Dishes and silverware"",""Cooking basics"",Oven,Stove,""Luggage dropoff allowed"",Waterfront}",NA,$99.00,NA,NA,$0.00,$0.00,2,$60.00,1,14,1,1,14,14,1,14,3 weeks ago,TRUE,28,58,88,178,2019-07-14,41,30,2018-05-19,2019-06-24,98,10,9,10,10,10,10,FALSE,NA,"{""Massachusetts State"","" Massachusetts State""}",FALSE,FALSE,flexible,FALSE,FALSE,1,0,1,0,2.91
