id,listing_url,scrape_id,last_scraped,name,summary,space,description,experiences_offered,neighborhood_overview,notes,transit,access,interaction,house_rules,thumbnail_url,medium_url,picture_url,xl_picture_url,host_id,host_url,host_name,host_since,host_location,host_about,host_response_time,host_response_rate,host_acceptance_rate,host_is_superhost,host_thumbnail_url,host_picture_url,host_neighbourhood,host_listings_count,host_total_listings_count,host_verifications,host_has_profile_pic,host_identity_verified,street,neighbourhood,neighbourhood_cleansed,neighbourhood_group_cleansed,city,state,zipcode,market,smart_location,country_code,country,latitude,longitude,is_location_exact,property_type,room_type,accommodates,bathrooms,bedrooms,beds,bed_type,amenities,square_feet,price,weekly_price,monthly_price,security_deposit,cleaning_fee,guests_included,extra_people,minimum_nights,maximum_nights,minimum_minimum_nights,maximum_minimum_nights,minimum_maximum_nights,maximum_maximum_nights,minimum_nights_avg_ntm,maximum_nights_avg_ntm,calendar_updated,has_availability,availability_30,availability_60,availability_90,availability_365,calendar_last_scraped,number_of_reviews,number_of_reviews_ltm,first_review,last_review,review_scores_rating,review_scores_accuracy,review_scores_cleanliness,review_scores_checkin,review_scores_communication,review_scores_location,review_scores_value,requires_license,license,jurisdiction_names,instant_bookable,is_business_travel_ready,cancellation_policy,require_guest_profile_picture,require_guest_phone_verification,calculated_host_listings_count,calculated_host_listings_count_entire_homes,calculated_host_listings_count_private_rooms,calculated_host_listings_count_shared_rooms,reviews_per_month
29765,https://www.airbnb.com/rooms/29765,20190714024644,2019-07-14,"Luxury suite, Moroccan furnishings",NA,"Romantic, comfortable, and elegant! Enjoy the hospitality and warmth of a home with luxury amenities for your relaxation and wellness: 3-room luxury suite with authentic Moroccan furnishings, in the beautifully-renovated & historic Thomas Osgood House in Boston close to the Freedom Trail, downtown, Boston Garden. King feather bed with Moroccan canopy tent. Elegant living room with fireplace. Marble bathroom with rain shower head. Full kitchen w. oven, microwave, dishwasher & fridge. A/C, TVs, wireless, fine linens provided. Cathedral ceilings, hand-hewn beams, skylights throughout--fresh flowers, very romantic space! Close to bus, metro, and great restaurants, pubs, wonderful groceries (Whole Foods). Safe, friendly neighborhood, Boston's oldest. Peaceful and historic courtyard garden with antique Boston gas lamp, fountain and pond (open in warmer weather April 1-November 30).   Your kitchen is fully stocked with delicious breakfast foods, to be enjoyed in the privacy of your suite (cof","Romantic, comfortable, and elegant! Enjoy the hospitality and warmth of a home with luxury amenities for your relaxation and wellness: 3-room luxury suite with authentic Moroccan furnishings, in the beautifully-renovated & historic Thomas Osgood House in Boston close to the Freedom Trail, downtown, Boston Garden. King feather bed with Moroccan canopy tent. Elegant living room with fireplace. Marble bathroom with rain shower head. Full kitchen w. oven, microwave, dishwasher & fridge. A/C, TVs, wireless, fine linens provided. Cathedral ceilings, hand-hewn beams, skylights throughout--fresh flowers, very romantic space! Close to bus, metro, and great restaurants, pubs, wonderful groceries (Whole Foods). Safe, friendly neighborhood, Boston's oldest. Peaceful and historic courtyard garden with antique Boston gas lamp, fountain and pond (open in warmer weather April 1-November 30).   Your kitchen is fully stocked with delicious breakfast foods, to be enjoyed in the privacy of your suite (cof",none,"Boston's oldest and most historic neighborhood, including the Freedom Trail, USS Constitution, and the site of the Battle of Bunker Hill, first battle of the American Revolution. Beautiful early American architecture, nice place to walk on gas-lit streets and by the harbor. Friendly people.",NA,"We are close to Community College stop on the Orange Line subway 8 minute-walk 92 bus to and from downtown 2 minute-walk Ferry from the Charlestown Navy Yard to downtown and the airport Uber, Lyft, and taxi available nearby Limited street parking only; public Pilgrim Parking Nautica garage is a 5-minute drive or 15-minute walk.  We recommend not bringing a car or parking it while you are in the city as driving and parking are difficult here.",NA,NA,"Maximum occupancy is 2 persons, no exceptions.  Hosted check in time is 4-8 p.m. Early and late check-ins are possible upon request in advance and subject to availability.  Check out time is 11 a.m.  Regretfully, for health and safety reasons, smoking is not permitted on the property. Regretfully, the space is not appropriate for young children, so we can't accommodate them. Regretfully, we cannot accommodate pets",NA,NA,https://a0.muscache.com/im/pictures/621420/77d899c1_original.jpg?aki_policy=large,NA,128280,https://www.airbnb.com/users/show/128280,Elizabeth,2010-05-19,"Boston, Massachusetts, United States","Friendly art historian/designer. 

Born and raised in Asia, I love international design and traditional folk arts, which is why my spaces are eclectic, decorated in European, Pan-Asian, and Moroccan styles. One of the main reasons I like sharing my spaces is because, in this way, I am also sharing experiences and beauty I have encountered while traveling.",within a few hours,100%,N/A,FALSE,https://a0.muscache.com/im/users/128280/profile_pic/1274308069/original.jpg?aki_policy=profile_small,https://a0.muscache.com/im/users/128280/profile_pic/1274308069/original.jpg?aki_policy=profile_x_medium,Charlestown,4,4,"['email', 'phone', 'reviews', 'kba']",TRUE,TRUE,"Boston, MA, United States",Charlestown,Charlestown,NA,Boston,MA,02129,Boston,"Boston, MA",US,United States,42.37834,-71.06663,TRUE,Apartment,Entire home/apt,2,1,1,1,Real Bed,"{TV,""Cable TV"",Internet,Wifi,""Air conditioning"",Kitchen,Breakfast,""Indoor fireplace"",Heating,""Smoke detector"",""Carbon monoxide detector"",""First aid kit"",""Fire extinguisher"",Essentials,Shampoo,Hangers,""Hair dryer"",Iron,""translation missing: en.hosting_amenity_49"",""translation missing: en.hosting_amenity_50"",""Self check-in"",Lockbox,""Hot water"",""Bed linens"",""Extra pillows and blankets"",Microwave,""Coffee maker"",Refrigerator,""Dishes and silverware"",""Garden or backyard"",""Luggage dropoff allowed""}",NA,$221.00,"$1,500.00","$3,900.00",$0.00,$25.00,2,$0.00,2,21,2,2,21,21,2,21,today,TRUE,10,34,44,201,2019-07-14,93,1,2010-05-24,2018-10-21,99,10,10,10,10,10,10,FALSE,NA,"{""Massachusetts State"","" Massachusetts State""}",TRUE,FALSE,strict_14_with_grace_period,FALSE,FALSE,3,2,1,0,0.84
44205,https://www.airbnb.com/rooms/44205,20190714024644,2019-07-14,Elegance at Salem Street Court,NA,"Romantic, comfortable, and elegant! Enjoy the hospitality and warmth of a home with luxury amenities for your relaxation and wellness: 3-room luxury suite with authentic European and Asian furnishings and fine art, in the beautifully-renovated & historic Thomas Osgood House close to Freedom Trail, downtown, and TD Garden in Boston's oldest neighborhood. Cathedral ceilings, hand-hewn beams, skylights throughout--fresh flowers, luxurious & romantic space! Large bedroom with king sleigh feather bed and ultimately soft modal cotton linens.  Elegant and cozy living room with leather sofas, oriental carpet, books, and French doors opening onto balcony with bistro table; overlooking historic courtyard garden with fountain and gas lamp. Grand European-style bath with oversized tub set below sklylight view to stars! Artisan soaps hand-crafted and organic. Microwave, fridge, toaster, coffee-maker; A/C, 2 satellite TVs, DVD, wireless internet, daily  housekeeping service. Your suite is fully stoc","Romantic, comfortable, and elegant! Enjoy the hospitality and warmth of a home with luxury amenities for your relaxation and wellness: 3-room luxury suite with authentic European and Asian furnishings and fine art, in the beautifully-renovated & historic Thomas Osgood House close to Freedom Trail, downtown, and TD Garden in Boston's oldest neighborhood. Cathedral ceilings, hand-hewn beams, skylights throughout--fresh flowers, luxurious & romantic space! Large bedroom with king sleigh feather bed and ultimately soft modal cotton linens.  Elegant and cozy living room with leather sofas, oriental carpet, books, and French doors opening onto balcony with bistro table; overlooking historic courtyard garden with fountain and gas lamp. Grand European-style bath with oversized tub set below sklylight view to stars! Artisan soaps hand-crafted and organic. Microwave, fridge, toaster, coffee-maker; A/C, 2 satellite TVs, DVD, wireless internet, daily  housekeeping service. Your suite is fully stoc",none,"Boston's oldest and most historic neighborhood, including the Freedom Trail, USS Constitution, and the site of the Battle of Bunker Hill, first battle of the American Revolution. Beautiful early American architecture, nice place to walk on gas-lit streets and by the harbor. Friendly people.",NA,"We are close to Community College stop on the Orange Line subway 8 minute-walk 92 bus to and from downtown 2 minute-walk Ferry from the Charlestown Navy Yard to downtown and the airport Uber, Lyft, and taxi available nearby Limited street parking only; public Pilgrim Parking Nautica garage is a 5-minute drive or 15-minute walk.  We recommend not bringing a car or parking it while you are in the city as driving and parking are difficult here.","A beautiful 3-room suite, balcony overlooking a courtyard garden, and a peaceful garden with a fountain.",NA,"Maximum occupancy 2 persons, no exceptions Check in is 4-8 p.m. Early and late check-ins are possible, but must be requested in advance and are subject to availability.  Check out time is 11 a.m. Late check-out is possible upon request in advance subject to availability. Regretfully, the suite is not appropriate for children and we cannot accommodate them. Regretfully, for health and safety reasons, there is no smoking on the property. Regretfully, we cannot accommodate pets",NA,NA,https://a0.muscache.com/im/pictures/618426/4a904e8d_original.jpg?aki_policy=large,NA,128280,https://www.airbnb.com/users/show/128280,Elizabeth,2010-05-19,"Boston, Massachusetts, United States","Friendly art historian/designer. 

Born and raised in Asia, I love international design and traditional folk arts, which is why my spaces are eclectic, decorated in European, Pan-Asian, and Moroccan styles. One of the main reasons I like sharing my spaces is because, in this way, I am also sharing experiences and beauty I have encountered while traveling.",within a few hours,100%,N/A,FALSE,https://a0.muscache.com/im/users/128280/profile_pic/1274308069/original.jpg?aki_policy=profile_small,https://a0.muscache.com/im/users/128280/profile_pic/1274308069/original.jpg?aki_policy=profile_x_medium,Charlestown,4,4,"['email', 'phone', 'reviews', 'kba']",TRUE,TRUE,"Boston, MA, United States",Charlestown,Charlestown,NA,Boston,MA,02129,Boston,"Boston, MA",US,United States,42.37655,-71.06677,FALSE,Apartment,Entire home/apt,2,1,1,1,Real Bed,"{TV,""Cable TV"",Internet,Wifi,""Air conditioning"",Breakfast,Heating,""Smoke detector"",""Carbon monoxide detector"",""First aid kit"",""Fire extinguisher"",Essentials,Shampoo,Hangers,""Hair dryer"",Iron,""translation missing: en.hosting_amenity_49"",""translation missing: en.hosting_amenity_50"",""Hot water"",""Bed linens"",""Extra pillows and blankets"",Microwave,""Coffee maker"",Refrigerator,""Dishes and silverware"",""Garden or backyard"",""Luggage dropoff allowed"",""Host greets you""}",NA,$184.00,"$1,300.00","$3,900.00",$0.00,$25.00,2,$0.00,2,21,2,2,21,21,2,21,today,TRUE,7,24,30,191,2019-07-14,82,3,2010-09-07,2019-04-16,99,10,10,10,10,10,10,FALSE,NA,"{""Massachusetts State"","" Massachusetts State""}",TRUE,FALSE,strict_14_with_grace_period,FALSE,FALSE,3,2,1,0,0.76
45987,https://www.airbnb.com/rooms/45987,20190714024644,2019-07-14,Gorgeous Garden Studio Charlestown,NA,"Lovely, private garden studio apartment in historic Boston neighborhood. The gorgeous studio has a private entrance through a lovely garden. It is a new renovation with hardwood floors and plenty of natural light. Cool in summer; toasty in winter. The sound of bubbling water in the garden's fish pond contributes to the tranquility of the space.  LATE ARRIVAL AFTER 10:00 p.m. WILL BE $150 CHARGES CASH BEFORE YOU RECEIVE THE KEYS.     PLEASE AND BEFORE YOU MAKE RESERVATION, MAKE SURE YOU KNOW YOUR TIME OF ARRIVAL.  I WILL NOT ACCEPT YOUR REVERBERATION WITHOUT YOUR TIME OF ARRIVAL.  THANK YOU.  Please, make sure you are honest with your reservation about the number of people staying.  I live at the same property. Please, make sure you do not smoke or look for another place. YES, MY HOUSE IS LESS THAN FIVE MINUTES TO BUS STOP AND SEVEN MINUTES TO SUBWAY (UNDERGROUND) Absolutely, no parties or visitors.   Yes, there is WiFi and $50 charge. Amenities: Fully-equipped kitchen (including gas st","Lovely, private garden studio apartment in historic Boston neighborhood. The gorgeous studio has a private entrance through a lovely garden. It is a new renovation with hardwood floors and plenty of natural light. Cool in summer; toasty in winter. The sound of bubbling water in the garden's fish pond contributes to the tranquility of the space.  LATE ARRIVAL AFTER 10:00 p.m. WILL BE $150 CHARGES CASH BEFORE YOU RECEIVE THE KEYS.     PLEASE AND BEFORE YOU MAKE RESERVATION, MAKE SURE YOU KNOW YOUR TIME OF ARRIVAL.  I WILL NOT ACCEPT YOUR REVERBERATION WITHOUT YOUR TIME OF ARRIVAL.  THANK YOU.  Please, make sure you are honest with your reservation about the number of people staying.  I live at the same property. Please, make sure you do not smoke or look for another place. YES, MY HOUSE IS LESS THAN FIVE MINUTES TO BUS STOP AND SEVEN MINUTES TO SUBWAY (UNDERGROUND) Absolutely, no parties or visitors.   Yes, there is WiFi and $50 charge. Amenities: Fully-equipped kitchen (including gas st",none,Historical and safe.,Read all details above.,Easy access to Public Transportation and walking.,I will be waiting for you.,Limited.,"No smoking! Please let me know as soon as you make reservation about your time of arrival.  Late arrival after 10:00 P.M. there will be $150 extra charge.  $50/more than one person during the holidays..  The use of the washer and dryer between 8:00 A.M.-9:00 P.M.  No refund if cancelled in less than two weeks.   Please take time to read all the house rule details on this site. Yes, I am very close to public transportation. Yes, you can walk every where from my place. Yes, I charge $50 for WiFi",NA,NA,https://a0.muscache.com/im/pictures/261758/678964ca_original.jpg?aki_policy=large,NA,205107,https://www.airbnb.com/users/show/205107,Atef,2010-08-18,"Boston, Massachusetts, United States","I am homeowner and an entrepreneur.  
I love my house where you will be staying and treat my guests as my family and friends.  I am also a traveler and did my share of traveling.  My favorite cities I visited is Paris, Barcelona, and  Alexandria, Egypt.
I love to exercise: tennis, cycling and weight lifting.
I also enjoy working with my hands: gardening, building furniture, and fixing my bicycles.

",within an hour,100%,N/A,FALSE,https://a0.muscache.com/im/pictures/45e6722e-94d8-4943-98c7-689e67e8ee6c.jpg?aki_policy=profile_small,https://a0.muscache.com/im/pictures/45e6722e-94d8-4943-98c7-689e67e8ee6c.jpg?aki_policy=profile_x_medium,Charlestown,1,1,"['email', 'phone', 'reviews', 'manual_offline', 'jumio', 'government_id']",TRUE,TRUE,"Charlestown, MA, United States",Charlestown,Charlestown,NA,Charlestown,MA,02129,Boston,"Charlestown, MA",US,United States,42.37404,-71.06118,TRUE,Apartment,Entire home/apt,3,1,1,1,Real Bed,"{Wifi,""Air conditioning"",Kitchen,""Pets live on this property"",Cat(s),Heating,""Family/kid friendly"",Washer,Dryer,""Smoke detector"",""Carbon monoxide detector"",""Fire extinguisher"",Shampoo}",NA,$125.00,NA,NA,NA,$100.00,1,$50.00,3,180,3,3,180,180,3,180,today,TRUE,7,36,66,341,2019-07-14,119,16,2010-08-23,2019-06-24,92,9,10,9,9,10,9,FALSE,NA,"{""Massachusetts State"","" Massachusetts State""}",TRUE,FALSE,strict_14_with_grace_period,TRUE,TRUE,1,1,0,0,1.1
77681,https://www.airbnb.com/rooms/77681,20190714024644,2019-07-14,Waterfall Room: Bunker Hill B&B,NA,"Elegant private suite, on its own floor with dressing room and full sized bed, jacuzzi bath, and access to a fabulous private deck. Furnished with antiques and includes a tv-vcr. Tempur-Pedic mattress. Pet friendly! Relaxing Breakfast Nook is a cozy and comfy eating area, it is adjacent to the patio. $20.00 refundable key deposit required.","Elegant private suite, on its own floor with dressing room and full sized bed, jacuzzi bath, and access to a fabulous private deck. Furnished with antiques and includes a tv-vcr. Tempur-Pedic mattress. Pet friendly! Relaxing Breakfast Nook is a cozy and comfy eating area, it is adjacent to the patio. $20.00 refundable key deposit required. book only one month in advance.",none,NA,book only one month in advance.,NA,NA,NA,"No candles, no smoking, no food in room, no private kitchen use.",NA,NA,https://a0.muscache.com/im/pictures/639949/96d3c990_original.jpg?aki_policy=large,NA,416912,https://www.airbnb.com/users/show/416912,Christiane,2011-03-01,"Boston, Massachusetts, United States","Christiane Wolff, the owner and hostess, is a former German teacher and former Army, Navy and US Coast Guard Reservist, who likes to offer weary travelers the same kindness and comforts that she received during her many travels.",within a few hours,100%,N/A,FALSE,https://a0.muscache.com/im/users/416912/profile_pic/1299014356/original.jpg?aki_policy=profile_small,https://a0.muscache.com/im/users/416912/profile_pic/1299014356/original.jpg?aki_policy=profile_x_medium,Charlestown,1,1,"['email', 'phone', 'reviews']",TRUE,FALSE,"Boston, MA, United States",Charlestown,Charlestown,NA,Boston,MA,02129,Boston,"Boston, MA",US,United States,42.37853,-71.06177,TRUE,Bed and breakfast,Private room,2,1,1,1,Real Bed,"{TV,Wifi,""Air conditioning"",Kitchen,Breakfast,""Hot tub"",Heating,""Family/kid friendly"",Washer,Dryer}",NA,$140.00,NA,NA,NA,NA,1,$0.00,2,730,2,2,730,730,2,730,3 months ago,TRUE,24,54,84,359,2019-07-14,40,9,2011-09-19,2019-05-19,86,9,9,9,9,9,9,FALSE,NA,"{""Massachusetts State"","" Massachusetts State""}",FALSE,FALSE,strict_14_with_grace_period,FALSE,FALSE,1,0,1,0,0.42
182613,https://www.airbnb.com/rooms/182613,20190714024644,2019-07-14,Entire 2 BR! Clean condo 3 beds Charlestown Boston,"Enjoy our modern 2 bedrooms with 3 beds and a big kitchen. 873 sqft near bus, train, downtown, Whole Foods, coffee shops, bars, restaurants, gym, pool, freedom trail, monument and many more. Great place w private parking in historical Boston!","2 bedrooms, 3 beds + sofa, one full bathroom and a full kitchen.  We enjoy welcoming our guests to our modern  condo in a brick building located in the middle of the historic Charlestown neighborhood in Boston, situated between Cambridge and the North End.  Our home is in a three stories building bordering the gas light district, a few blocks from the Bunker Hill monument,  Freedom Trail, and the USS Constitution.  High speed wireless internet, Wi-Fi, internet HDTV with Blu-Ray player and basic cable TV are all included.  It is a quiet building and both rooms are furnished with beds (2 fulls and 1 queen) and desks. Brazilian Cherry hardwood floors and high ceilings. Heat and air cooling in each bedroom and living areas. We both speak French, Spanish and English but usually not all at once. One room fits 2, the other 4 and the sofa 2 but let us know if you have children/babies or want to discuss options. It is ideal for 2 couples but it can fit more. There is no elevator and the condo i","Enjoy our modern 2 bedrooms with 3 beds and a big kitchen. 873 sqft near bus, train, downtown, Whole Foods, coffee shops, bars, restaurants, gym, pool, freedom trail, monument and many more. Great place w private parking in historical Boston! 2 bedrooms, 3 beds + sofa, one full bathroom and a full kitchen.  We enjoy welcoming our guests to our modern  condo in a brick building located in the middle of the historic Charlestown neighborhood in Boston, situated between Cambridge and the North End.  Our home is in a three stories building bordering the gas light district, a few blocks from the Bunker Hill monument,  Freedom Trail, and the USS Constitution.  High speed wireless internet, Wi-Fi, internet HDTV with Blu-Ray player and basic cable TV are all included.  It is a quiet building and both rooms are furnished with beds (2 fulls and 1 queen) and desks. Brazilian Cherry hardwood floors and high ceilings. Heat and air cooling in each bedroom and living areas. We both speak French, Spani",none,"In the Neighborhood: numerous parks, pool, bike paths,Whole Food, Tangerino’s restaurant, Fig’s pizzeria, Oysteria (Legal Sea Food), Grasshopper cafe, Zume and Sorelle, antique shops and much more.  We are near the Bunker Hill Burying Ground, which is Charlestown's second municipal burial place (the first was established on Phipps Street in 1630). In the summer a pool opens on Bunker Hill St. There is also a gym down the street at the YMCA in the Navy Yard (it has an indoor pool and a basket ball court). The walking path alongside the water in the Navy Yard is amazing in the summer.",- We can provide gated / private parking but you need to check with us before your trip to make we secure the spot and that you do not get towed.  - No pets / no smoking / no partying / no late night noise inside the building.,"We are near public transportation - bus 93 stops across the street and bus 92 comes on Main street (a few blocks away). We are walking distance from 2 orange T Stops (Community College and Sullivan Square), all go to downtown Boston (in 5 to 10 minutes). Real-time schedules and door-to-door itineraries are available for free on the web or via mobile apps. We are 10 minutes to / from Logan airport or South Station (buses / trains to NYC and DC) using the Big Dig (underground highway). A cab ride to/from South Station averages  $15 and $25 from/to the airport. Ask for a van to the attendants if needed and they will call/request one for you. Overnight parking is allowed and free on the street with different rules for each street. Parking can also be free / unlimited during the day, depending on dates and street. We can usually arrange for a private parking spot ahead of your stay if you let us know. Lastly there are ""Zipcar"" only parking spots, which can be great for visitors who do not n",Note: nothing is shared - we are renting out the entire apartment and you have access to all amenities in the condo and in the common areas of the building.,We always meet guests in person and can stop by if needed/requested. We are always an email / call / text away. We live a few blocks away.,"- Very Important: please let us know your estimated arrival / departure times so that we can plan accordingly. Check out by default is before 12 pm and check in after 2 pm within a one hour window, unless we mutually agree on something else. We will offer flexible check in / out times when possible but we need time between guests for a thorough cleaning.  - You will find fresh bath towels, beds made with fresh linens and the place will be clean  - Please make sure you always park legally to avoid parking fines / towing  - It is a quiet residential building so please be mindful of others residents - We are happy to provide directions / activities - It is a relaxed / informal setting, come as you are!",NA,NA,https://a0.muscache.com/im/pictures/3293f722-4a56-46bc-9519-cdacf359f764.jpg?aki_policy=large,NA,875739,https://www.airbnb.com/users/show/875739,Max,2011-07-26,United States,"I have been living in New England since 1998 and I am originally from Paris, France. I am a technology and strategy advisor to large companies and am a partner at Harmeda, a strategy consulting firm.",within an hour,100%,N/A,TRUE,https://a0.muscache.com/im/users/875739/profile_pic/1313637930/original.jpg?aki_policy=profile_small,https://a0.muscache.com/im/users/875739/profile_pic/1313637930/original.jpg?aki_policy=profile_x_medium,Charlestown,1,1,"['email', 'phone', 'facebook', 'reviews', 'kba']",TRUE,TRUE,"Boston, MA, United States",Charlestown,Charlestown,NA,Boston,MA,02129,Boston,"Boston, MA",US,United States,42.37739,-71.06044,TRUE,Apartment,Entire home/apt,6,1,2,3,Real Bed,"{TV,Internet,Wifi,""Air conditioning"",Kitchen,""Free parking on premises"",""Free street parking"",""Buzzer/wireless intercom"",Heating,""Family/kid friendly"",Washer,Dryer,""Smoke detector"",""Carbon monoxide detector"",""First aid kit"",""Safety card"",""Fire extinguisher"",Essentials,Shampoo,""24-hour check-in"",Hangers,""Hair dryer"",Iron,""Laptop friendly workspace"",Bathtub,""Babysitter recommendations"",""Pack ’n Play/travel crib"",""Room-darkening shades"",""Hot water"",""Bed linens"",""Extra pillows and blankets"",""Ethernet connection"",Microwave,""Coffee maker"",Refrigerator,Dishwasher,""Dishes and silverware"",""Cooking basics"",Oven,Stove,""Luggage dropoff allowed"",""Long term stays allowed"",""Host greets you""}",875,$169.00,"$1,230.00","$4,900.00",NA,$150.00,4,$25.00,6,1124,6,6,1124,1124,6,1124,today,TRUE,0,0,0,0,2019-07-14,106,13,2011-08-06,2019-06-13,96,10,10,10,10,10,10,FALSE,NA,"{""Massachusetts State"","" Massachusetts State""}",TRUE,FALSE,flexible,FALSE,FALSE,1,1,0,0,1.1
