16706225,https://www.airbnb.com/rooms/16706225,20190714024644,2019-07-14,Luxury 1BR condo near bunker hill monument,"Luxury 1br condo easily accessible to Downtown Boston! Highly recommend walking- enjoy beautiful views of the city, Bunker Hill Monument, North End, Quincy Market, TD Garden and more. The T (orange line) is easily accessible, about 7 minute walk!  If you prefer to stay in enjoy a 65 inch flatscreen 4K TV equipped w/cable, HBO, Netflix and Amazon Prime. There is also a working wood fireplace for those cold, cozy nights and a shared rooftop with a 360 degree amazing view of the city.","1BR condo right in the heart of historic Charlestown. Easily walk to some amazing restaurants and bars in town- Brewer's Fork, Monument Restaurant and the oldest restaurant in Boston, Warren Tavern to name a few. The famous North End is also accessible easily by foot. Master bedroom with king sized bed.","Luxury 1br condo easily accessible to Downtown Boston! Highly recommend walking- enjoy beautiful views of the city, Bunker Hill Monument, North End, Quincy Market, TD Garden and more. The T (orange line) is easily accessible, about 7 minute walk!  If you prefer to stay in enjoy a 65 inch flatscreen 4K TV equipped w/cable, HBO, Netflix and Amazon Prime. There is also a working wood fireplace for those cold, cozy nights and a shared rooftop with a 360 degree amazing view of the city. 1BR condo right in the heart of historic Charlestown. Easily walk to some amazing restaurants and bars in town- Brewer's Fork, Monument Restaurant and the oldest restaurant in Boston, Warren Tavern to name a few. The famous North End is also accessible easily by foot. Master bedroom with king sized bed. Shared rooftop with incredible views of the city! We are available by text and phone. Happy to give you a bunch of recommendations or just stay out of your way! Quiet neighborhood in historic Charlestown minu",none,"Quiet neighborhood in historic Charlestown minutes from Downtown Boston, Assembly Row (movie theater and shopping), and the North End! For food I highly recommend Brewer's Fork for Sunday brunch, lunch and dinner.  They also have tons of beer to choose from. Monument has great cocktails and good food. Warren Tavern is a famous historical tavern that has great beer and food.","When you enter address for Uber it's best to add 58 Sullivan St, Charlestown, MA 02129. The street numbers on this street are off.","Easily walkable to many places including all of Charlestown, the North End, Quincy Market, etc. The T - Train stop (orange line) is a less than 10 minute walk and takes you directly to downtown Boston. Plus with uber and uber pool so affordable, it is another great way to get around Boston. There is street parking if needed.",Shared rooftop with incredible views of the city!,We are available by text and phone. Happy to give you a bunch of recommendations or just stay out of your way!,NA,NA,NA,https://a0.muscache.com/im/pictures/71831a1b-5b6a-4a05-a998-6d3da5ba1a2b.jpg?aki_policy=large,NA,4766459,https://www.airbnb.com/users/show/4766459,Jesse,2013-01-19,"Boston, Massachusetts, United States","Fae and I love going out and trying the new hot restaurants seeing Boston sports games, and just exploring what this amazing city has to offer. 
We are  happy to give you recommendations about all of the awesome places to go, or we can leave you totally alone!

We are both in the medical field. I am a pediatric Nurse Practitioner at Boston Medical Center, and Fae is an operations manager at Beth Israel Deaconess Hospital.  

We look forward to to hosting you!",within an hour,100%,N/A,FALSE,https://a0.muscache.com/im/pictures/b308c27e-9baa-44f9-94f2-08fd87cf3549.jpg?aki_policy=profile_small,https://a0.muscache.com/im/pictures/b308c27e-9baa-44f9-94f2-08fd87cf3549.jpg?aki_policy=profile_x_medium,NA,1,1,"['email', 'phone', 'facebook', 'google', 'reviews', 'kba']",TRUE,TRUE,"Boston, MA, United States",Charlestown,Charlestown,NA,Boston,MA,02129,Boston,"Boston, MA",US,United States,42.37884,-71.06524,FALSE,Condominium,Entire home/apt,3,1,1,1,Real Bed,"{TV,""Cable TV"",Internet,Wifi,Kitchen,""Indoor fireplace"",Heating,""Family/kid friendly"",Washer,Dryer,""Smoke detector"",""Carbon monoxide detector"",""Fire extinguisher"",Essentials,Shampoo,""Hair dryer"",Iron,""Laptop friendly workspace"",Microwave,""Coffee maker"",Refrigerator,Dishwasher,""Dishes and silverware"",""Cooking basics"",Oven,Stove,""Patio or balcony""}",NA,$175.00,NA,NA,NA,NA,1,$0.00,2,1125,2,4,1125,1125,2,1125,2 weeks ago,TRUE,0,1,4,4,2019-07-14,6,4,2017-03-19,2019-06-17,96,9,9,10,10,9,9,FALSE,NA,"{""Massachusetts State"","" Massachusetts State""}",FALSE,FALSE,moderate,FALSE,FALSE,1,1,0,0,0.21
16858996,https://www.airbnb.com/rooms/16858996,20190714024644,2019-07-14,Modern Meets Historic Stunning Charlestown RowHome,"Stunning 2,500 SF row home located in the beautiful gas-lit neighborhood of Charlestown!  This historic home built in 1814 maintains its true character and charm while offering all the comforts of home. Only a 5 minute walk to the Bunker Hill Monument, the Freedom Trail and great local restaurants. A quick 15 minute walk to the Navy Yard, the North End, Boston TD Garden, and a 20 minute walk to downtown makes our Charlestown home the perfect location for your next trip to Boston.","This large spacious 4 bedroom, 3 1/2 bathroom historic home is fully renovated while maintaining the original character and charm from the 1800's.  Three floors, two gorgeous fireplaces, chefs kitchen and outdoor patio will make you feel right at home.","Stunning 2,500 SF row home located in the beautiful gas-lit neighborhood of Charlestown!  This historic home built in 1814 maintains its true character and charm while offering all the comforts of home. Only a 5 minute walk to the Bunker Hill Monument, the Freedom Trail and great local restaurants. A quick 15 minute walk to the Navy Yard, the North End, Boston TD Garden, and a 20 minute walk to downtown makes our Charlestown home the perfect location for your next trip to Boston. This large spacious 4 bedroom, 3 1/2 bathroom historic home is fully renovated while maintaining the original character and charm from the 1800's.  Three floors, two gorgeous fireplaces, chefs kitchen and outdoor patio will make you feel right at home. Guests will have access the entire house, and back patio. We are just a phone call, email or text away Whole Foods is a 5 minute walk away.  Ironside, a great local bar located at the end of the street, Warren Tavern the oldest tavern in Massachusetts, visited b",none,"Whole Foods is a 5 minute walk away.  Ironside, a great local bar located at the end of the street, Warren Tavern the oldest tavern in Massachusetts, visited by many famous individuals including George Washington and Paul Revere is only a 10 minute walk.  The T (train stop) and the bus stop are both a 3 minute walk, and the Boston TD Garden/North Station and Downtown Boston are just beyond the Charlestown bridge a 15-minute walk!","There is NO parking on our street.  There is street parking available on our cross street and around the park, please read the parking signs.  There are also two parking garages with in walking distance to our home.","The Bunker Hill Monument, the Freedom Trail and great local restaurants are all with in a 5 minute walk.  A 15 minute walk to the Navy Yard, the North End, Boston TD Garden and a 20 minute walk to downtown.  There is a T (train stop) and bus stop about 3 minutes way.  Uber or Lyft car service is always available and the airport is a 15-20 minute ride away.","Guests will have access the entire house, and back patio.","We are just a phone call, email or text away","- Please respect our neighbors, no loud music after 10pm - If you choose to cook please use the exhaust fan over the stove while cooking. - Please load the dishwasher and turn it on before you leave, there is detergent under the skin. - Please take out the trash it is located outside the kitchen door, just toss everything into the black trash cans",NA,NA,https://a0.muscache.com/im/pictures/e1bc7d84-7b23-4031-810b-641f58c241c4.jpg?aki_policy=large,NA,107398258,https://www.airbnb.com/users/show/107398258,David,2016-12-15,US,NA,within an hour,100%,N/A,TRUE,https://a0.muscache.com/im/pictures/9f1c341f-4a9f-4cee-9258-ded730429cf3.jpg?aki_policy=profile_small,https://a0.muscache.com/im/pictures/9f1c341f-4a9f-4cee-9258-ded730429cf3.jpg?aki_policy=profile_x_medium,Charlestown,5,5,"['email', 'phone', 'reviews', 'offline_government_id', 'selfie', 'government_id', 'identity_manual']",TRUE,FALSE,"Charlestown, MA, United States",Charlestown,Charlestown,NA,Charlestown,MA,02129,Boston,"Charlestown, MA",US,United States,42.37433,-71.05938,TRUE,Townhouse,Entire home/apt,8,3.5,4,4,Real Bed,"{TV,""Cable TV"",Internet,Wifi,""Air conditioning"",Kitchen,""Indoor fireplace"",Heating,""Family/kid friendly"",Washer,Dryer,""Smoke detector"",""Carbon monoxide detector"",Essentials,Shampoo,""Lock on bedroom door"",""24-hour check-in"",Hangers,""Hair dryer"",Iron,""Laptop friendly workspace"",""Self check-in"",Lockbox,""Private entrance""}",NA,$400.00,NA,NA,$300.00,$250.00,1,$0.00,2,1125,2,2,1125,1125,2,1125,today,TRUE,0,0,0,0,2019-07-14,11,0,2017-04-11,2017-08-27,100,9,10,9,10,10,10,FALSE,NA,"{""Massachusetts State"","" Massachusetts State""}",TRUE,FALSE,moderate,FALSE,FALSE,1,1,0,0,0.4
17207702,https://www.airbnb.com/rooms/17207702,20190714024644,2019-07-14,Tudor Wharf- Boston Harbor Studio Apartment,"Studio Apartment located in the the Tudor Wharf- Boston Harbor area and is conveniently located within walking distance of downtown Boston, the historic North End, Boston Harbor and TD Banknorth Garden.  All of our beautiful studio apartments come equipped with full kitchens, refrigerators, cook tops, separate living and dining areas, and ample space to work or just relax. Includes daily full hot breakfast buffet and free WiFi.",Property Amenities include: Full Kitchenette in room  Daily full hot breakfast buffet  Free High speed internet in room and public areas  Daily housekeeping services  Indoor Pool 24 Hour Fitness Center 24 Hour Laundry Facility  On site Parking (additional fee applies)  Pet Friendly (deposit required),"Studio Apartment located in the the Tudor Wharf- Boston Harbor area and is conveniently located within walking distance of downtown Boston, the historic North End, Boston Harbor and TD Banknorth Garden.  All of our beautiful studio apartments come equipped with full kitchens, refrigerators, cook tops, separate living and dining areas, and ample space to work or just relax. Includes daily full hot breakfast buffet and free WiFi. Property Amenities include: Full Kitchenette in room  Daily full hot breakfast buffet  Free High speed internet in room and public areas  Daily housekeeping services  Indoor Pool 24 Hour Fitness Center 24 Hour Laundry Facility  On site Parking (additional fee applies)  Pet Friendly (deposit required) 24 Hour Guest service available Please note an additional 14.45% tax will apply to your room rate per night",none,NA,Please note an additional 14.45% tax will apply to your room rate per night,NA,NA,24 Hour Guest service available,NA,NA,NA,https://a0.muscache.com/im/pictures/6cdadff7-aa10-45ab-a63b-41ee291d70e0.jpg?aki_policy=large,NA,115815443,https://www.airbnb.com/users/show/115815443,Stephanie,2017-02-10,US,NA,N/A,N/A,N/A,FALSE,https://a0.muscache.com/im/pictures/a8709f4f-2868-473d-af7d-656cc1c0ed69.jpg?aki_policy=profile_small,https://a0.muscache.com/im/pictures/a8709f4f-2868-473d-af7d-656cc1c0ed69.jpg?aki_policy=profile_x_medium,Charlestown,1,1,"['phone', 'work_email']",TRUE,FALSE,"Boston, MA, United States",Charlestown,Charlestown,NA,Boston,MA,02129,Boston,"Boston, MA",US,United States,42.37145,-71.06094,TRUE,Apartment,Private room,2,1,0,1,Real Bed,"{TV,Wifi,""Air conditioning"",Pool,Kitchen,""Free parking on premises"",""Pets allowed"",Gym,Breakfast,Elevator,""Hot tub"",Heating,""Family/kid friendly"",""Suitable for events"",Washer,Dryer,""Smoke detector"",Essentials,Shampoo,""Lock on bedroom door"",Hangers,""Hair dryer"",Iron,""Laptop friendly workspace""}",NA,$299.00,NA,NA,NA,NA,1,$0.00,30,60,30,30,60,60,30,60,10 months ago,TRUE,29,59,89,179,2019-07-14,0,0,NA,NA,NA,NA,NA,NA,NA,NA,NA,FALSE,NA,"{""Massachusetts State"","" Massachusetts State""}",FALSE,FALSE,flexible,FALSE,FALSE,1,0,1,0,NA
17461256,https://www.airbnb.com/rooms/17461256,20190714024644,2019-07-14,Single Family Home in Charlestown,Renovated single family home with yard 10 minute drive to downtown Boston.,NA,Renovated single family home with yard 10 minute drive to downtown Boston.,none,NA,NA,NA,NA,NA,NA,NA,NA,https://a0.muscache.com/im/pictures/2845fcf2-b4a6-4edf-a68d-bfd10d8680e7.jpg?aki_policy=large,NA,4689046,https://www.airbnb.com/users/show/4689046,Abigail,2013-01-13,"Boston, Massachusetts, United States",I work as a reporting analyst in mutual funds.,N/A,N/A,N/A,FALSE,https://a0.muscache.com/im/users/4689046/profile_pic/1358112342/original.jpg?aki_policy=profile_small,https://a0.muscache.com/im/users/4689046/profile_pic/1358112342/original.jpg?aki_policy=profile_x_medium,Charlestown,1,1,"['email', 'phone', 'reviews', 'kba']",TRUE,TRUE,"Charlestown, MA, United States",Charlestown,Charlestown,NA,Charlestown,MA,02129,Boston,"Charlestown, MA",US,United States,42.38129,-71.06627,TRUE,House,Entire home/apt,4,1,2,2,Real Bed,"{TV,Wifi,Kitchen,""Indoor fireplace"",Heating,""Family/kid friendly"",Washer,Dryer,""Smoke detector"",""Carbon monoxide detector"",Essentials,""Lock on bedroom door"",""Hair dryer"",Iron,""Laptop friendly workspace""}",NA,$300.00,NA,NA,NA,NA,1,$0.00,3,7,3,3,7,7,3,7,28 months ago,TRUE,0,0,0,0,2019-07-14,0,0,NA,NA,NA,NA,NA,NA,NA,NA,NA,FALSE,NA,"{""Massachusetts State"","" Massachusetts State""}",TRUE,FALSE,flexible,FALSE,FALSE,1,1,0,0,NA
17656957,https://www.airbnb.com/rooms/17656957,20190714024644,2019-07-14,Entire Three Level near Casio and Subway,"Newly-built 3-story, 5-bedroom, 3.5-bathroom house located near Sullivan T station (3 minuets walking). Convenient public transportation to Downtown Boston, Harvard, MIT. Walking distance to coffee stores and restaurants. Uber/Lyft is available easily.",NA,"Newly-built 3-story, 5-bedroom, 3.5-bathroom house located near Sullivan T station (3 minuets walking). Convenient public transportation to Downtown Boston, Harvard, MIT. Walking distance to coffee stores and restaurants. Uber/Lyft is available easily.",none,NA,NA,NA,NA,NA,"1. No damage to the house or furniture 2. Do not move around big furniture 3. No Smoking, No Pets, No Drugs 4. No shoes 5. No large gathering or “parties"" 6. No more sleepover people then you booked.  7. Keep quiet after 11:00 PM 8. Be respectful to neighbors  9. Do not walk beyond the property boundaries 10. Keep the kitchen clean after used  11. Keep the bathroom clean after used 12. Keep the apartment tidy and clean all the time 13. Check-in: 3PM, Check-out: 11:00AM",NA,NA,https://a0.muscache.com/im/pictures/e1271076-8784-435f-a6fa-805a6ccaeb12.jpg?aki_policy=large,NA,19246369,https://www.airbnb.com/users/show/19246369,Joe,2014-07-31,"Somerville, Massachusetts, United States",NA,within an hour,93%,N/A,FALSE,https://a0.muscache.com/im/pictures/a961fa2d-896b-4e64-a0fa-003be79c275f.jpg?aki_policy=profile_small,https://a0.muscache.com/im/pictures/a961fa2d-896b-4e64-a0fa-003be79c275f.jpg?aki_policy=profile_x_medium,Somerville,8,8,"['email', 'phone', 'reviews', 'jumio', 'government_id']",TRUE,FALSE,"Boston, MA, United States",Charlestown,Charlestown,NA,Boston,MA,02129,Boston,"Boston, MA",US,United States,42.38488,-71.07701,TRUE,House,Entire home/apt,13,3.5,5,6,Real Bed,"{TV,""Cable TV"",Wifi,""Air conditioning"",Kitchen,Heating,""Family/kid friendly"",""Smoke detector"",""Carbon monoxide detector"",Essentials,Shampoo,""Lock on bedroom door"",Hangers,""Hair dryer"",Iron,""Laptop friendly workspace"",""Private living room"",""Private entrance"",""Hot water"",""Bed linens"",""Extra pillows and blankets"",Microwave,""Coffee maker"",Refrigerator,Dishwasher,""Dishes and silverware"",""Cooking basics"",Oven,Stove,""Patio or balcony"",""Garden or backyard"",""Luggage dropoff allowed"",""Long term stays allowed"",Other}",NA,$599.00,NA,NA,$500.00,$250.00,6,$25.00,5,1125,5,5,1125,1125,5,1125,today,TRUE,12,42,72,162,2019-07-14,26,9,2017-04-26,2019-06-15,92,10,9,10,10,9,9,FALSE,NA,"{""Massachusetts State"","" Massachusetts State""}",TRUE,FALSE,strict_14_with_grace_period,FALSE,FALSE,1,1,0,0,0.96
17667949,https://www.airbnb.com/rooms/17667949,20190714024644,2019-07-14,"LOCATION! 3BR Modern Home, Train, Downtown, BCEC","Location! Large 1700sf modern house across the street from Whole Foods (1 minute), CVS, Coffee, etc. and the train station, 5 minutes to heart of the city! Next to Museum of Science and 15 minute walk from Galleria Mall. Close to everything. Walk to the freedom trail and downtown by foot. Everything is on smart system including door codes, thermostat, etc. Never worry about a key. Check in anytime after 4pm with a door code. House is professionally cleaned an sanitized.","Our large 1700sf beautiful home is on 3 levels and very conveniently located across Whole Foods shopping plaza in the gaslit part of town of Charlestown. It's picturesque, beautiful and close to everything Boston has to offer. You can travel on foot or the train 2 blocks from the house and one stop into the heart of Boston. It is part of the freedom trail.  You have the whole home (upper unit of a 2 unit building). You can also book our lower home along with the upper home (renting the entire building). Lower unit can sleep 4 more if you desire to have more guests when traveling. Parking on our private driveway is available by request. We only accept compact cars, sedans, and small sized SUVs. Anything larger will need prior approval is not going to fit inside the parking spot if there is another car in the next space. In this case, you'll have to park on the streets in the visitor's sections and is not guaranteed. Note during winter snow storms, parking is not guaranteed at all due to","Location! Large 1700sf modern house across the street from Whole Foods (1 minute), CVS, Coffee, etc. and the train station, 5 minutes to heart of the city! Next to Museum of Science and 15 minute walk from Galleria Mall. Close to everything. Walk to the freedom trail and downtown by foot. Everything is on smart system including door codes, thermostat, etc. Never worry about a key. Check in anytime after 4pm with a door code. House is professionally cleaned an sanitized. Our large 1700sf beautiful home is on 3 levels and very conveniently located across Whole Foods shopping plaza in the gaslit part of town of Charlestown. It's picturesque, beautiful and close to everything Boston has to offer. You can travel on foot or the train 2 blocks from the house and one stop into the heart of Boston. It is part of the freedom trail.  You have the whole home (upper unit of a 2 unit building). You can also book our lower home along with the upper home (renting the entire building). Lower unit can s",none,"Walk 1 minute to Whole Foods. You can actually see it right out your window! Lots of restaurants and coffee shops. Famous Todd English Figs Restaurant, Monument Restaurant, and plethora of other great restaurants and bars walking distance in the area. Feel like ice skating or playing hockey?  There is a public rink 3 minute walk from our house.",The oven is disabled for the safety of guests and kids,"You are 2 blocks from the train station and a plethora of buses. On a nice summer day, you can walk to downtown through the freedom trail. One of the safest neighborhoods and picturesque areas of Boston with famous restaurants.  10 minutes from Boston Logan Airport 15 minute walk to Little Italy in North End 12 minute by train to Prudential Center Back Bay 7 minutes to Boston Commons 15 minutes to Harvard University and MIT Close to everything!",NA,"We strive to respond in a timely manner by text, email or phone. We're a smart home and you never have to worry about keys. Each guest will have a unique key code to the door so you never have to worry about sharing keys.","- STRICTLY NO PETS. We are severely allergic to animals. - CHECK IN/OUT: Check in at 4pm and Check out promptly at 11am on the dates specified on your booking site. Every 10 minutes of late check out is subject to a $20 late fee unless otherwise agreed upon with owner. We can usually accommodate later check outs but it has to be communicated prior because our cleaners are very punctual and charged by the their time. Thank you!  - AGE RESTRICTION: Someone over the age of 25 must be present to book the house. - MAX PERSONS: Maximum occupancy of the house cannot exceed the number of persons stated on the listing or you will automatically forfeit your deposit. - PARTIES: No parties or events allowed. If there is a party in the house and items are damaged, house is left filthy, etc., your stay is automatically ended with no refund, forfeit of your deposit and whatever additional cleaning and damage fees will be responsibility of the guest. We absolutely do not tolerate parties where large a",NA,NA,https://a0.muscache.com/im/pictures/f5493f28-ec6b-4fdc-a58b-24c7cfefd025.jpg?aki_policy=large,NA,62572217,https://www.airbnb.com/users/show/62572217,Julie,2016-03-11,"Boston, Massachusetts, United States",NA,within an hour,100%,N/A,FALSE,https://a0.muscache.com/im/pictures/85631a18-3fb4-48db-b029-5191721349b2.jpg?aki_policy=profile_small,https://a0.muscache.com/im/pictures/85631a18-3fb4-48db-b029-5191721349b2.jpg?aki_policy=profile_x_medium,South Boston,3,3,"['email', 'phone', 'reviews', 'kba', 'work_email']",TRUE,TRUE,"Boston, MA, United States",Charlestown,Charlestown,NA,Boston,MA,02129,Boston,"Boston, MA",US,United States,42.37443,-71.06483,TRUE,House,Entire home/apt,8,1.5,3,6,Real Bed,"{TV,""Cable TV"",Wifi,""Air conditioning"",Kitchen,""Free parking on premises"",Heating,""Family/kid friendly"",Washer,Dryer,""Smoke detector"",""Carbon monoxide detector"",""Safety card"",Essentials,Shampoo,Hangers,""Hair dryer"",Iron,""Laptop friendly workspace"",""Self check-in"",""Smart lock"",""Private entrance"",""High chair"",""Children’s books and toys"",Crib,""Children’s dinnerware"",""Hot water"",""Bed linens"",Microwave,""Coffee maker"",Refrigerator,Dishwasher,""Dishes and silverware"",Stove,""Long term stays allowed""}",NA,$99.00,NA,NA,$300.00,$135.00,5,$25.00,1,1125,1,2,1125,1125,1.3,1125,today,TRUE,6,21,41,190,2019-07-14,71,18,2017-04-10,2019-06-19,94,9,10,10,10,10,9,FALSE,NA,"{""Massachusetts State"","" Massachusetts State""}",FALSE,FALSE,strict_14_with_grace_period,FALSE,FALSE,3,3,0,0,2.58
