9900315,https://www.airbnb.com/rooms/9900315,20190714024644,2019-07-14,Uncommon Place (free parking!),"Welcome to my recently renovated home in the beautiful, historic, gas-lit district of Boston's Charlestown neighborhood. It is a quiet retreat in a renovated 1800s schoolhouse steps away from the Bunker Hill monument, freedom trail, TD Garden, and the North End.","The apartment has 12' ceilings and plenty of light- it is big and open with modern appliances and contemporary decor (I used to be an interior designer and completely renovated the space last year). It is located on a small, recently renovated park.. with your own designated parking space in a lot right behind the building.","Welcome to my recently renovated home in the beautiful, historic, gas-lit district of Boston's Charlestown neighborhood. It is a quiet retreat in a renovated 1800s schoolhouse steps away from the Bunker Hill monument, freedom trail, TD Garden, and the North End. The apartment has 12' ceilings and plenty of light- it is big and open with modern appliances and contemporary decor (I used to be an interior designer and completely renovated the space last year). It is located on a small, recently renovated park.. with your own designated parking space in a lot right behind the building. You'll have access to the entire apartment on the 2nd floor of a 5 unit building. A key will be left in a lockbox near the entry. I'll be renting my apartment while I'm away on business or personal vacations, so you will be on your own, but I will always be available by phone or email and have friends nearby should anything come up that needs immediate attention. Charlestown is the best neighborhood in Bosto",none,Charlestown is the best neighborhood in Boston (I may be biased)!! It is steps from all the action but removed enough to feel calm and quaint and really provide a true New England experience.,NA,Less than 10 min walk to the Orange and Green lines at North Station or the Orange line at Community College station.,You'll have access to the entire apartment on the 2nd floor of a 5 unit building. A key will be left in a lockbox near the entry.,"I'll be renting my apartment while I'm away on business or personal vacations, so you will be on your own, but I will always be available by phone or email and have friends nearby should anything come up that needs immediate attention.",Please treat my home as you would your own.,NA,NA,https://a0.muscache.com/im/pictures/c0e0cd2a-077f-4c21-a1ad-ba0fc065ee31.jpg?aki_policy=large,NA,724846,https://www.airbnb.com/users/show/724846,Kelly,2011-06-20,"Boston, Massachusetts, United States","33yo female designer. live in boston, work as an app designer. love soul/jazz music, working out, watching sports, meeting new people, exploring new places, and any excuse to be creative.",within a few hours,100%,N/A,FALSE,https://a0.muscache.com/im/pictures/da919504-7979-4e7b-ab74-491dee54586a.jpg?aki_policy=profile_small,https://a0.muscache.com/im/pictures/da919504-7979-4e7b-ab74-491dee54586a.jpg?aki_policy=profile_x_medium,Charlestown,2,2,"['email', 'phone', 'reviews', 'jumio', 'offline_government_id', 'kba', 'government_id']",TRUE,TRUE,"Boston, MA, United States",Charlestown,Charlestown,NA,Boston,MA,02129,Boston,"Boston, MA",US,United States,42.37395,-71.06128,TRUE,Apartment,Entire home/apt,2,1,1,1,Real Bed,"{Internet,Wifi,""Air conditioning"",Kitchen,""Free parking on premises"",Heating,""Smoke detector"",""Carbon monoxide detector"",""First aid kit"",""Safety card"",""Fire extinguisher"",Essentials,Shampoo,""24-hour check-in"",Hangers,""Hair dryer"",Iron,""Laptop friendly workspace"",""translation missing: en.hosting_amenity_50"",""Self check-in"",Lockbox,""Hot water"",""Bed linens""}",NA,$150.00,NA,NA,$0.00,$30.00,2,$0.00,4,200,4,12,200,200,6,200,a week ago,TRUE,0,0,0,107,2019-07-14,42,11,2016-03-17,2019-07-01,97,10,10,10,10,10,10,FALSE,NA,"{""Massachusetts State"","" Massachusetts State""}",FALSE,FALSE,strict_14_with_grace_period,FALSE,FALSE,1,1,0,0,1.04
10253899,https://www.airbnb.com/rooms/10253899,20190714024644,2019-07-14,"Large, lovely 4BR home in Boston","100% 5-star ratings Great for families We are looking for a tenant for summer 2019. Enjoy Boston and New England from a home of your own! 4BR home complete with all amenities. Full eat-in kitchen, large living and dining areas. Patio with grill. Across the street from large dog park, playground, and basketball court. Located in the Boston neighborhood of Charlestown. Very walkable.","Charlestown is a beautiful, historic neighborhood of Boston.  Very walkable and bikeable.  Easy access to downtown by bus or subway, or a lovely walk.  You'll still feel the historic charm of this house, built in the 1850s for James Phipps, a harnessmaker, and his family.  It is a sunny, old house with modern amenities and tons of space. You will have full access to all of the amenities and appliances in the home. There is access to a washer and dryer in the basement, free of charge, and towels will be provided in both bathrooms. Extra towels and linens will also be provided, as well as dishes and cleaning supplies. Heating can be controlled by the guests and can be adjusted to suit the weather.  For long-term stays, cleaning service is available.","100% 5-star ratings Great for families We are looking for a tenant for summer 2019. Enjoy Boston and New England from a home of your own! 4BR home complete with all amenities. Full eat-in kitchen, large living and dining areas. Patio with grill. Across the street from large dog park, playground, and basketball court. Located in the Boston neighborhood of Charlestown. Very walkable. Charlestown is a beautiful, historic neighborhood of Boston.  Very walkable and bikeable.  Easy access to downtown by bus or subway, or a lovely walk.  You'll still feel the historic charm of this house, built in the 1850s for James Phipps, a harnessmaker, and his family.  It is a sunny, old house with modern amenities and tons of space. You will have full access to all of the amenities and appliances in the home. There is access to a washer and dryer in the basement, free of charge, and towels will be provided in both bathrooms. Extra towels and linens will also be provided, as well as dishes and cleaning s",none,"Charlestown is fun and funky, very walkable and friendly.   There are several neighborhood restaurants and old Boston taverns (you have to make time for Warren Tavern, allegedly Boston's oldest bar).  An easy walk along the Freedom Trail, Bunker Hill Monument, the USS Constitution, and the North End.  Hopefully you'll have time to explore downtown Boston, but many locals here might ask, ""Why would anyone want to leave Charlestown?"" haha","If you're hear for more than a couple weeks, it would be a big help if you could bring our mail in. There is a big public swimming pool at the top of our street - gorgeous in the summer!","Bus to downtown Boston runs along our street, the #92.  Half-mile walk to the T subway, the Orange Line.  Also great bike lanes.","We will leave keys for guest so you can enter on your own.  The house has a large, enclosed patio.  The first floor has a living room, dining room with seating for 10, and eat-in kitchen.  The second floor has two large bedrooms, both with queen beds, and one full bathroom.  Also there is a small storage on the second floor, not part of the rental.  The third floor has two kids bedrooms, both with 2 twin beds, and a full bathroom.","We won't be there, but can easily stop by to help if something comes up.",Most important - respect the neighbors. No parties or loud music.,NA,NA,https://a0.muscache.com/im/pictures/2bafda3b-82ba-4579-aef1-0086377f95b5.jpg?aki_policy=large,NA,14561673,https://www.airbnb.com/users/show/14561673,Megan,2014-04-21,"Boston, Massachusetts, United States","Family of five, looking to find adventures and make friends.   We are very respectful of our neighbors, and would like our guests to have this as a priority too!",within a few hours,100%,N/A,TRUE,https://a0.muscache.com/im/users/14561673/profile_pic/1398126621/original.jpg?aki_policy=profile_small,https://a0.muscache.com/im/users/14561673/profile_pic/1398126621/original.jpg?aki_policy=profile_x_medium,NA,2,2,"['email', 'phone', 'facebook', 'reviews', 'kba']",TRUE,TRUE,"Boston, MA, United States",Charlestown,Charlestown,NA,Boston,MA,02129,Boston,"Boston, MA",US,United States,42.38092,-71.06756,FALSE,House,Entire home/apt,8,2,4,6,Real Bed,"{TV,""Cable TV"",Internet,Wifi,""Air conditioning"",Kitchen,""Pets allowed"",Heating,""Family/kid friendly"",Washer,Dryer,""Smoke detector"",""Carbon monoxide detector"",""First aid kit"",""Safety card"",""Fire extinguisher"",Essentials,Shampoo,""24-hour check-in"",Hangers,""Hair dryer"",Iron,""Laptop friendly workspace""}",NA,$250.00,"$1,500.00","$4,000.00",NA,$125.00,1,$0.00,6,1125,6,6,1125,1125,6,1125,2 months ago,TRUE,4,5,5,5,2019-07-14,6,1,2016-04-19,2018-08-31,100,10,10,10,10,10,10,FALSE,NA,"{""Massachusetts State"","" Massachusetts State""}",FALSE,FALSE,strict_14_with_grace_period,FALSE,FALSE,1,1,0,0,0.15
11395461,https://www.airbnb.com/rooms/11395461,20190714024644,2019-07-14,Large studio with parking spot!,"Studio condo located on the freedom trail one block from Bunker Hill Monument. Walking distance to the T, the North End, local bars/restaurants, as well as a Whole Foods Market. Private parking space and private patio included. pet friendly.","This condo is nestled deep in the heart of historic Boston. Located less than one mile from the USS Constitution/Navy Yard, Freedom Trail, and also the Bunker Hill Monument. Included is a private parking spot, garden patio, and cozy studio condo with all the amenities of home. Pet friendly space.","Studio condo located on the freedom trail one block from Bunker Hill Monument. Walking distance to the T, the North End, local bars/restaurants, as well as a Whole Foods Market. Private parking space and private patio included. pet friendly. This condo is nestled deep in the heart of historic Boston. Located less than one mile from the USS Constitution/Navy Yard, Freedom Trail, and also the Bunker Hill Monument. Included is a private parking spot, garden patio, and cozy studio condo with all the amenities of home. Pet friendly space.",none,NA,NA,NA,NA,NA,NA,NA,NA,https://a0.muscache.com/im/pictures/b2ce9a96-0476-4614-8a8a-d5dde9bde899.jpg?aki_policy=large,NA,59792146,https://www.airbnb.com/users/show/59792146,Kelley,2016-02-21,"Boston, Massachusetts, United States",NA,N/A,N/A,N/A,FALSE,https://a0.muscache.com/im/pictures/56fffcce-ee5f-48a1-b49d-9acde14ee301.jpg?aki_policy=profile_small,https://a0.muscache.com/im/pictures/56fffcce-ee5f-48a1-b49d-9acde14ee301.jpg?aki_policy=profile_x_medium,Charlestown,1,1,"['email', 'phone', 'facebook']",TRUE,TRUE,"Boston, MA, United States",Charlestown,Charlestown,NA,Boston,MA,02129,Boston,"Boston, MA",US,United States,42.37355,-71.06236,TRUE,Apartment,Entire home/apt,2,1,0,1,Real Bed,"{TV,""Cable TV"",Wifi,""Air conditioning"",Kitchen,""Pets allowed"",""Pets live on this property"",Dog(s),""Buzzer/wireless intercom"",Heating,""Family/kid friendly"",Washer,Dryer,""Smoke detector"",""Carbon monoxide detector"",""First aid kit"",""Fire extinguisher"",Essentials,Hangers,""Hair dryer"",Iron,""Laptop friendly workspace""}",NA,$300.00,NA,NA,NA,NA,1,$0.00,1,1125,1,1,1125,1125,1,1125,41 months ago,TRUE,0,0,0,0,2019-07-14,0,0,NA,NA,NA,NA,NA,NA,NA,NA,NA,FALSE,NA,"{""Massachusetts State"","" Massachusetts State""}",FALSE,FALSE,flexible,FALSE,FALSE,1,1,0,0,NA
11521541,https://www.airbnb.com/rooms/11521541,20190714024644,2019-07-14,Historic and Charming Brownstone!!,"Located in Boston's oldest neighborhood, this 4 bedroom/3 bathroom exudes history and charm on a peaceful, tree-lined street.  Within walking distance to the Bunker Hill Monument, the U.S.S. Constitution in the Navy Yard, Whole Foods, Restaurants, Faneuil Hall, and Public Transportation.  The city is at your fingertips!!","The 2500 square foot brownstone opens to a grand entryway, and continues to a large stylish living room, dining room with table for 8, powder room, and a fully stocked kitchen with new appliances including a double oven, and granite countertops.  The kitchen opens out to a private deck with a patio surrounded by lush landscaping.   The 2nd floor features a luxury master bedroom with a King temperpedic mattress, and en suite bathroom with a jacuzzi and stand up shower.  There is also a laundry room with brand new washer and dryer. The 3rd floor offers 3 bedrooms, one with a queen bed, one with a double bed and one with a twin bed with a trundle that rolls out into another twin bed. A den with a TV and a full size futon and full bathroom completes the 3rd floor. WIFI and Cable are included.  Kitchen offers Keurig machine and Nespresso Machine (some coffee K Cups included).","Located in Boston's oldest neighborhood, this 4 bedroom/3 bathroom exudes history and charm on a peaceful, tree-lined street.  Within walking distance to the Bunker Hill Monument, the U.S.S. Constitution in the Navy Yard, Whole Foods, Restaurants, Faneuil Hall, and Public Transportation.  The city is at your fingertips!! The 2500 square foot brownstone opens to a grand entryway, and continues to a large stylish living room, dining room with table for 8, powder room, and a fully stocked kitchen with new appliances including a double oven, and granite countertops.  The kitchen opens out to a private deck with a patio surrounded by lush landscaping.   The 2nd floor features a luxury master bedroom with a King temperpedic mattress, and en suite bathroom with a jacuzzi and stand up shower.  There is also a laundry room with brand new washer and dryer. The 3rd floor offers 3 bedrooms, one with a queen bed, one with a double bed and one with a twin bed with a trundle that rolls out into anoth",none,NA,"The 2500 square foot brownstone opens to a grand entryway, and continues to a large stylish living room, dining room with table for 8, powder room, and a fully stocked kitchen with new appliances including a double oven, and granite countertops.  The kitchen opens out to a private deck with a patio surrounded by lush landscaping.   The 2nd floor features a luxury master bedroom with a King temperpedic mattress, and en suite bathroom with a jacuzzi and stand up shower.  There is also a laundry room with brand new washer and dryer. The 3rd floor offers 2 bedrooms, one with a queen bed and one with a double bed.  There is a sitting area which could be used to sleep 2 more on an air mattress.  A full bathroom p and a sitting area completes the 3rd floor. WIFI and Cable are included.  Kitchen offers Keurig machine and Nespresso Machine (some coffee K Cups included).",The Orange Line T stop is a 10 minute walk from the house.  Bus stop is less than a minute walk from the house.,Less than a minute walk to the Bus Stop! Or take a Ferry from the Charlestown Navy Yard to Downtown!,Always available if anything is needed!,NA,NA,NA,https://a0.muscache.com/im/pictures/9904b963-13e1-4e27-aa72-3b915c79778e.jpg?aki_policy=large,NA,14133713,https://www.airbnb.com/users/show/14133713,Katy,2014-04-10,"Boston, Massachusetts, United States",NA,within an hour,86%,N/A,FALSE,https://a0.muscache.com/im/pictures/user/d0fb530b-301e-4876-85ee-e66a0c0d0e69.jpg?aki_policy=profile_small,https://a0.muscache.com/im/pictures/user/d0fb530b-301e-4876-85ee-e66a0c0d0e69.jpg?aki_policy=profile_x_medium,NA,2,2,"['email', 'phone', 'reviews']",TRUE,FALSE,"Boston, MA, United States",Charlestown,Charlestown,NA,Boston,MA,02129,Boston,"Boston, MA",US,United States,42.38195,-71.06867,FALSE,House,Entire home/apt,6,3,4,4,Real Bed,"{TV,Internet,Wifi,""Air conditioning"",Kitchen,""Free street parking"",Heating,""Family/kid friendly"",Washer,Dryer,""Smoke detector"",""Carbon monoxide detector"",""First aid kit"",""Fire extinguisher"",Essentials,Shampoo,Hangers,""Hair dryer"",Iron,""Laptop friendly workspace"",""Self check-in"",Lockbox,""Hot water"",""Luggage dropoff allowed"",""Long term stays allowed""}",NA,$780.00,"$3,200.00",NA,"$1,000.00",$200.00,1,$0.00,2,1125,2,2,1125,1125,2,1125,today,TRUE,25,55,85,360,2019-07-14,10,0,2016-06-05,2018-05-04,88,9,8,8,8,9,8,FALSE,NA,"{""Massachusetts State"","" Massachusetts State""}",FALSE,FALSE,moderate,FALSE,FALSE,1,1,0,0,0.26
11837857,https://www.airbnb.com/rooms/11837857,20190714024644,2019-07-14,Freedom trail condo with amazing Boston views,"My place is close to Freedom Trail, Bunker Hill Monument, Navy Yard, North End, Downtown. You’ll love my place because of the space - 1,000 square feet, two large bedrooms, two full bathrooms, AMAZING VIEW!, the neighborhood, the comfy bed, the light.","This sunny, modern and spacious two-bedroom condo atop Bunker Hill has AMAZING views over the whole of Boston, from both inside the condo and out, taking in the Monument, the north end, downtown and Back Bay. The large, 1,000 square foot space is all newly decorated and furnished, and on a single, open-plan floor.  The large kitchen leads on to a larger dining room/living room with dining space and soft seating (large sofa, two arm chairs) for 5-6.    Nearly the entire rear wall of the condo is windows overlooking the amazing views.   There are two bedrooms - the master has a king bed and en-suite bathroom with shower, and the second bedroom has a queen bed.  There's also a second bedroom with bath tub and shower. The amazing outside space is a highlight and has the best views in Boston. We have a little lawn and a deck that overlooks the whole city.  On the deck we have a gas BBQ, as well as a daybed for taking in the view and an outdoor dining table for six.","My place is close to Freedom Trail, Bunker Hill Monument, Navy Yard, North End, Downtown. You’ll love my place because of the space - 1,000 square feet, two large bedrooms, two full bathrooms, AMAZING VIEW!, the neighborhood, the comfy bed, the light. This sunny, modern and spacious two-bedroom condo atop Bunker Hill has AMAZING views over the whole of Boston, from both inside the condo and out, taking in the Monument, the north end, downtown and Back Bay. The large, 1,000 square foot space is all newly decorated and furnished, and on a single, open-plan floor.  The large kitchen leads on to a larger dining room/living room with dining space and soft seating (large sofa, two arm chairs) for 5-6.    Nearly the entire rear wall of the condo is windows overlooking the amazing views.   There are two bedrooms - the master has a king bed and en-suite bathroom with shower, and the second bedroom has a queen bed.  There's also a second bedroom with bath tub and shower. The amazing outside spac",none,"Charlestown is Boston's oldest neighbourhood.  It's a charming, historic area that's home to to the Navy Yard, Bunker Hill Monument and Freedrom Trai.  It's  known for it's charm, tree-lined streets and beautiful homes.   Charlestown has many great pubs and restaurants, including a Legal Seafoods (Legal Oysteria), The Warren Tavern (one of the oldest pubs in the US) and Figs.   Charlestown is walking distance to the North End and TD Garden (20 minutes), and downtown (30 minutes).  If you prefer public transit, there are two T stops (Community College and Sullivan Square) and many bus stops.",NA,"From our place, you can walk to TD Garden and North End in 20 minutes and downtown in 30.  We're close to the T (Community College; 5 minute walk) with easy access to all of Boston and surrounding area.  Bus stop is 20 seconds from our front door and this provides access to the North End, Downtown and the Back Bay. Hubway (Boston bike sharing scheme) racks are 5 minutes from our front door.",NA,"We won't be staying while you're here, but we're very happy to help however we can.","- We live in a rowhouse that contains three units.  Please be respectful to our neighbors and keep the noise down - Past 11pm, please very quiet if you're still on the deck to respect our neighbors",NA,NA,https://a0.muscache.com/im/pictures/2a104ef0-92f5-437c-81cd-e1cdc6b8b5c5.jpg?aki_policy=large,NA,4100684,https://www.airbnb.com/users/show/4100684,Laurel,2012-11-09,"Boston, Massachusetts, United States",NA,N/A,N/A,N/A,FALSE,https://a0.muscache.com/im/pictures/a1d4b104-a16a-41ca-8fd7-9d972baae7da.jpg?aki_policy=profile_small,https://a0.muscache.com/im/pictures/a1d4b104-a16a-41ca-8fd7-9d972baae7da.jpg?aki_policy=profile_x_medium,Charlestown,1,1,"['email', 'phone', 'facebook', 'reviews', 'jumio', 'government_id']",TRUE,TRUE,"Boston, MA, United States",Charlestown,Charlestown,NA,Boston,MA,02129,Other (International),"Boston, MA",US,United States,42.38,-71.0657,TRUE,Condominium,Entire home/apt,4,2,2,2,Real Bed,"{TV,Internet,Wifi,""Air conditioning"",Kitchen,""Indoor fireplace"",Heating,""Family/kid friendly"",Washer,Dryer,""Smoke detector"",""Carbon monoxide detector"",Essentials,""Lock on bedroom door"",""translation missing: en.hosting_amenity_50""}",NA,$350.00,NA,NA,$250.00,$100.00,1,$0.00,1,10,1,1,10,10,1,10,36 months ago,TRUE,0,0,0,0,2019-07-14,0,0,NA,NA,NA,NA,NA,NA,NA,NA,NA,FALSE,NA,"{""Massachusetts State"","" Massachusetts State""}",FALSE,FALSE,strict_14_with_grace_period,FALSE,FALSE,1,1,0,0,NA
12149592,https://www.airbnb.com/rooms/12149592,20190714024644,2019-07-14,Large Studio Historic Charlestown,"1 large room (divided to bedroom and living areas), spacious kitchen and newly renovated bathroom. Private Entrance!  Use of patio, great for outside dinners; Safe neighborhood Close to public transportation, 1 minute from Bunker Hill Monument",NA,"1 large room (divided to bedroom and living areas), spacious kitchen and newly renovated bathroom. Private Entrance!  Use of patio, great for outside dinners; Safe neighborhood Close to public transportation, 1 minute from Bunker Hill Monument Phone or text",none,NA,NA,NA,NA,Phone or text,Quiet time after 10PM,NA,NA,https://a0.muscache.com/im/pictures/14da6c81-76c3-403f-b4f5-321a34622c6a.jpg?aki_policy=large,NA,65234391,https://www.airbnb.com/users/show/65234391,Eszter,2016-03-31,"Boston, Massachusetts, United States",NA,within a few hours,100%,N/A,FALSE,https://a0.muscache.com/im/pictures/3e19ab25-1a54-4311-8a6e-c55efa537e52.jpg?aki_policy=profile_small,https://a0.muscache.com/im/pictures/3e19ab25-1a54-4311-8a6e-c55efa537e52.jpg?aki_policy=profile_x_medium,Charlestown,2,2,"['email', 'phone', 'facebook', 'reviews', 'jumio', 'government_id']",TRUE,TRUE,"Boston, MA, United States",Charlestown,Charlestown,NA,Boston,MA,02129,Boston,"Boston, MA",US,United States,42.37702,-71.06049,TRUE,Apartment,Entire home/apt,2,1,0,1,Real Bed,"{TV,Wifi,Kitchen,Washer,Dryer,""Smoke detector"",""First aid kit"",""Fire extinguisher"",Essentials,Hangers,""Hair dryer""}",NA,$124.00,NA,NA,$0.00,$20.00,1,$0.00,3,1125,3,3,1125,1125,3,1125,2 weeks ago,TRUE,7,15,26,26,2019-07-14,9,6,2016-05-04,2019-07-13,91,10,10,10,10,10,10,FALSE,NA,"{""Massachusetts State"","" Massachusetts State""}",FALSE,FALSE,moderate,FALSE,FALSE,1,1,0,0,0.23
12208705,https://www.airbnb.com/rooms/12208705,20190714024644,2019-07-14,One room in Charlestown,"Private room in Charlestown, bed and bath.",NA,"Private room in Charlestown, bed and bath.",none,NA,NA,NA,NA,NA,NA,NA,NA,https://a0.muscache.com/im/pictures/8bc539ee-1bbe-45f2-835b-66cb4ded5237.jpg?aki_policy=large,NA,65656106,https://www.airbnb.com/users/show/65656106,Rachel,2016-04-03,"Boston, Massachusetts, United States",NA,N/A,N/A,N/A,FALSE,https://a0.muscache.com/im/pictures/user/2c22e38c-e793-4421-879c-233ff1484667.jpg?aki_policy=profile_small,https://a0.muscache.com/im/pictures/user/2c22e38c-e793-4421-879c-233ff1484667.jpg?aki_policy=profile_x_medium,Charlestown,2,2,"['email', 'phone', 'offline_government_id', 'government_id']",TRUE,FALSE,"Boston, MA, United States",Charlestown,Charlestown,NA,Boston,MA,02129,Boston,"Boston, MA",US,United States,42.37522,-71.0615,TRUE,Apartment,Private room,1,1,1,1,Real Bed,"{TV,""Cable TV"",Internet,Wifi,""Air conditioning"",Kitchen,Elevator,""Hot tub"",""Buzzer/wireless intercom"",Heating,Washer,Dryer,""Smoke detector"",""Carbon monoxide detector"",""First aid kit"",""Safety card"",""Fire extinguisher"",Essentials,Shampoo,""Lock on bedroom door"",""24-hour check-in"",Hangers,""Hair dryer"",Iron,""Laptop friendly workspace"",""translation missing: en.hosting_amenity_49"",""translation missing: en.hosting_amenity_50""}",NA,$200.00,NA,NA,NA,NA,1,$0.00,1,1125,1,1,1125,1125,1,1125,4 months ago,TRUE,0,0,0,0,2019-07-14,0,0,NA,NA,NA,NA,NA,NA,NA,NA,NA,FALSE,NA,"{""Massachusetts State"","" Massachusetts State""}",FALSE,FALSE,flexible,FALSE,FALSE,1,0,1,0,NA
